"There are 6 parliamentary constituencies in Jammu and Kashmir Baramulla, Jammu, Srinagar, Udhampur, Anantnag and Ladakh."
Can that be said?
This is an electric operated bike.
"Whats up, sir?"
These values of selfless service to others are now helping the countrymen in this difficult time
Frequent headaches can affect relationships and employment.
Fans went berserk over this.
"At present, the accused is in jail."
killing children
They are not filmmakers.
A distance of nearly 200 kilometres.
He is adored by women all over the world.
Helpline for students
Removing a disk from a RAID array may degrade it
"Often, the host will accompany the guest partway down the road and continue conversing with him."
"But, it's true!!"
The city needs the Metro.
Grieving father
C/C Account No.2009
Also read: All you need to know about Jammu and Kashmir
And Federer?
It's about time too.
They demanded him to give money.
"Five of its new bases are in Jaipur, Varanasi, Mangalore, Hajipur(Bihar) and Nuh (Haryana)."
Traffic congestion:
and 800 B.C.
And its easy to do.
This is a crucial evidence in the case.
Expected identifier for class selector but found %1$S.
There are no proper roads.
"Indian automaker Mahindra & Mahindra is all set to gain from the government's latest order of 10,000 electric vehicles"
You can use baskets or utensil.
"On a Hampshire Bowl track where Dhoni struggled to 28 off 52 against Afghanistan, captain Virat Kohli was effortless during his 63-ball stay that fetched 67 runs at a strike-rate of above 100."
"If it is not, this is"
It does not mean it is easy.
Are Science and the Bible Compatible?
Lets see what these are.
"Athletics, Badminton, Basketball, Hockey, Boxing Cricket, Cycling, Football, Gymnastics, Judo, Kabadi, Kho-kho, tennis, wrestling, table tennis, Volleyball, weight lifting, swimming and rifle shooting."
Many were arrested.
WHO welcomes India's emergency use authorisation approval to COVID-19 vaccines
The wheatlike Christians would be collected together in unity and the weeds would eventually be destroyed.
And this can be done in several ways.
His character is named Ramkumar Yadav.
US-China tariff war
These are the Brahmins.
I just stood there.
What has your government done?
"', it said."
"New Delhi: Former RBI governor Raghuram Rajan features in the list of probables for this years Nobel Prize in Economics, The Wall Street Journal has reported."
Family problems will be resolved.
South Goa
"India reports single-day spike of 60,963 coronavirus cases, 834 deaths"
India lodge protest
Roasted rice flour - 1 cup
This is not childs play.
The tournament will be held under different age categories.
"For centuries, our ancestors have lived this way."
And there are other benefits.
Remember that the majority of the Indian citizens dont know Hindi and have expressed no demand to know it.
What are the services provided?
"""The most common non-immigrant visa is the multiple-purpose B-1/B-2 visa, also known as the """"visa for temporary visitors for business or pleasure."""""""
Do you miss Hyderabad?
I am not politically conscious.
"A meeting would be convened to discuss the issue, he said."
Rebuild yourself.
That is most dangerous.
And how about outside the house?
"Hence, I had to join the Congress."
Chic office attire
"For the wrath of God is revealed from heaven against all ungodliness and unrighteousness of men, who suppress the truth in unrighteousness,"
Is eating meat worth the risk?
Let us come together.
Let us also bear in mind the apostle Pauls admonition: Let him that thinks he is standing beware that he does not fall. 1 Cor.
Parental attention is vital for students.
There seems to be no end to the tariff wars in the telecom sector.
The accused is being further interrogated.
What a situation!
The incident occurred in Paretha Village of Madhya Pradeshs Chhatarpur.
But only partly so.
"However, police prevented them."
We dont get anything.
"Cut off from their community, the families began making their own cheese."
"Even as we look at the gradual withdrawal of the lockdown, we should constantly remember that till we do not find a vaccine or a solution, the biggest weapon with us to the fight the virus is social distancing, he said."
Union Budget 2019: Key takeaways
"The palace was in its heyday, the summer palace of the Scindias"
The tree can grow up to 40 metres.
Social mores and celebrity
Both are currently at NCB office.
Do meditation and yoga daily
This includes Tata with their Harrier-based 'Cassini' and the Renault Triber. both of which are expected to launch in the Indian market sometime during the latter part of 2019
"In the last five years, Indias average rate of real GDP growth has been 7 and Surveys projections are that, to become a $ 5 trillion economy by 2024-25, with an annual rate of inflation of 4%, real GDP growth will have to be 8%"
"Keep Your Life Simple First, look at Jesus counsel on the matter of wealth."
It is not a suicide but murder.
War and Love
"""I was ordered to return immediately."""""""
It has become a mass movement.
Congress President Rahul Gandhi to continue his Gujarat-style election campaign in poll-bound Karnataka.
Eravikulam National Park
Ducati has introduced the new special edition 959 Panigale Corse with a sporty livery inspired by the Ducati MotoGP team
A criminal case was registered against them.
"Where a home for everyone, and electricity in every home is a reality."
"Kane Williamson (captain), BJ Watling (wicketkeeper), Jeet Raval, Tom Latham, Ross Taylor, Henry Nicholls, Colin de Grandhomme, Mitchell Santner, Tim Southee, Matt Henry, Trent Boult, Neil Wagner, Todd Astle, Lockie Ferguson, and Tom Blundell."
Rate of growth estimated to be 6.9%.
"We believe there is vast scope to combine our relative advantages, whether of capital, technology or human resources, to work for mutual benefit."
It will protect you from secular philosophies that could destroy your faith. Read Proverbs 2: 10 - 12.
"Important suppliers include Thailand, Bangladesh, India, Indonesia and Malaysia."
"If proven guilty, am ready to go to jail."
But all this is difficult to achieve.
A case has been registered under Hanumanpura police station limits.
Saina will face Thailands Pornpawee Chochuwong in the first round.
She speaks Kannada and Tulu languages.
"Its extremely rare, but it exists."
Why patronise them?
Forward calls to the given host if busy
Malls & Restaurants
"In reality, ritual duties were almost always carried out by priests."
The complete details of the project will be announced soon.
This is classic old school.
Customer or worker?
What could happen?
Q: Who are you?
The Government policies should be encouraging these small entrepreneurs.
Those injured were taken to Lucknow for medical treatment.
in some northern provinces.
"When the man did not answer, Maria continued: Even if you gave me all the money in the world, it would not be enough because money cannot buy life. You do not have children, do you?"
It has no profiteering purpose.
The ancient planes had 40 small engines.
Stun them with love.
"Of the 13 who contested, 11 won the by-polls."
How has been your political journey so far?
Also present were AJSU Party chief and former Jharkhand deputy chief minister Sudesh Mahto. BJP state general secretary Deepak Prakash. and AJSU Party leader and minister in the Raghubar Das cabinet Chandra Prakash Choudhary.
He was born in 1949 and pursued a career in racing even though his family did not support his decision
They do not want development in the area.
"Rajasthan election results: Congress wins in West Bikaner, BJP retains East"
Darwins theory (of evolution of humans) is scientifically wrong.
Sugar 1/4 cup
Don't lose faith.
"This, I admit, is an error on the part of BBMP."
Waiting to exhale
We will not try to bring the government down.
The marriage ceremony was done in both Konkani and Sikh traditions.
"Spot gold climbed 0.1% to $1,782.21 per ounce."
Police shot dead four of the attackers.
Then he came along.
She is the first Indian woman who won that crown
The children were elated.
"And the LORD appeared unto Abram, and said, Unto thy seed will I give this land: and there builded he an altar unto the LORD, who appeared unto him."
Some dreams come true
Have they resigned?
Many companies are advising work from home.
"He said: Take a warning: To the making of many books there is no end, and much devotion to them is wearisome to the flesh."
It concerns everyone.
People have been arriving from morning.
Nobody has left the party.
Rice at Rs 2 per kg
Keep this aside.
Peel and mince the garlic and mix it with the olive oil.
Add half a teaspoon of baking soda to half a glass of water and mix well.
What is cross training?
The trailer has increased the curiosity of the fans.
Wait for the next elections?
Team India is under pressure to perform following T-20 series loss against an upbeat South Africa
Well not be able to show our face to them again.
Vehicles were stranded on both sides of the road.
Tributes paid to the martyred soldiers
There are no lights.
You can find more information on that in this article.
4000 cash reward.
The memory can be extended by using a micro SD card.
What did that man say?
Heres The Truth
"The abuse of alcohol leads to additional problems, such as alcoholism, cirrhosis, broken families, and traffic accidents."
Flight services resume from Chennai. 116 passengers leave for Delhi
7 Bangladeshis held for illegal stay in Maha
o An important role in achieving the goal of doubling farmers income.
A political party is about an ideology.
The driver of the truck reportedly fled from the spot after the accident.
"The symptoms include swelling of hands and feet, redness and burning sensation and itching."
We know who the killers are.
They have never revealed this.
"India has won two, and lost six of those."
"In addition,there were also games for children."
Budget 2020
Mi 9T is coming soon!
Roads are broken.
"Vishukumar, Director, Kannada and Culture, will be the chief guests."
"The CI filed four chargesheets against Mohammed Akbar Ismail Chowdhari, Aneeq Shafique Sayeed, Farooq Sharfuddin Tarkash and Mohammed Sadiq Israr Ahmed Shaik."
It is a social activity.
This is a usual practice.
The remaining work would be completed soon.
We love all our brothers and sisters because they are all fellow worshipers of Jehovah God.
They differ.
The father of the girl lodged a complaint with the police.
Swamiji asserted.
The CBI should probe this issue.
Iron increases the levels of haemoglobin in the blood.
These are such people.
Aniket spent a good three months training at English club Blackburn Rovers during the close season
100 per cent result.
I also love jamming.
No decision was made.
Colourful 2018
What to do in the winter
Is this a big deal?
Jack-o-lanterns were hanging at the school gate.
Do not be afraid to speak up.
But I didn't let it happen.
There are many reasons to this.
In each and every game we made a lot of mistakes.
It never stops.
Your account has been activated.
So who came?
Digital India
3 schoolchildren killed as dumper falls into river
Size and Price:
Weakness of a limb or part of the face
Nominations were also filed.
The DSP rank accorded to Harmanpreet Kaur has reportedly been withdrawn by the Punjab government over the controversy over her graduation degree.
This claim is false.
Nobel Prize in Physics awarded to three scientists for discoveries in cosmology
Taurus : This day you are likely to face some health problems.
He also did not make any direct comment on BJP's prime ministerial candidate Narendra Modi
"That, though, is something else."
Finally we know !
You must read this.
"The Make in India campaign needs to succeed by manufacturing for global markets, it said."
"Following the imposition of the Governor's rule in Jammu & Kashmir, Congress leaders have expressed fears that it might result in return of the 'muscular policy' to deal with the Kashmir problem."
"Tehran has invited the United States, Ukraine, Canada and others to join the crash investigation."
Locals rushed to the spot and helped police evacuate trapped passengers
The next battle?
Within a years time he was repatriated.
But no exact figures are available in this regard.
Read it:
"Hesse is home to Germany's financial capital Frankfurt, where major lenders like Deutsche Bank and Commerzbank have their headquarters"
This was supported by the government too.
They didnt give up.
Subrahmanyam is a 1985-batch IAS officer and a JNU alumni.
"Once the pre-owned channels kick in, Triumph will be at competition with the Benelli TRK 502 and TRK 502X, the Hyosung GT650R and PRO650, the Kawasaki Vulkan S, and the Harley Davidson Street 750"
The deceased has left behind his wife and two children.
Vacancies: 10 Posts
"Home / India News / President Kovind, PM Modi greet citizens on Ganesh Chaturthi"
Marketing Managers
Fishermen have also been cautioned against venturing into the sea.
"With this, the smartphone is the first device to be powered by the Helio G80 processor."
on testing
"""""""Why should we remain in this business?"""
"""My heartfelt gratitude to each and everyone who extended their cooperation to me."""""""
Several others were injured and taken to hospital.
"Because of failing to make Jehovah their refuge, many fall in spiritual death at our very side."
All things are naked and openly exposed to the eyes of him with whom we have an accounting.
So they are pricing that as well.
Ive also done a number of music albums.
H_old Call
a Planning Board
Good person.
The protesters shouted slogans against Prime Minister Narendra Modi and the BJP-led government at the Centre and in Maharashtra.
But I didn't mean it that way
Prime Minister Manmohan Singh and Congress President Sonia Gandhi interact with families of riot victims at Bassi Kalan relief camp in Muzaffarnagar on Monday
Australian Capital Territory
Who can take a gold loan?
"""""""Government has to be fair."""
Parasurameswara Temple in Gudimallam is placed at a distance of about 20 km from Tirupati
Very sad incident happened in Rajasthan.
Election is festival of democracy.
Use the account at Proverbs 5: 3 - 14 to help your teen understand the harmful consequences of fornication.
"Rutherford, who was then overseeing the work, gladly volunteered as a bellhop, carrying luggage and escorting conventioners to their rooms."
Haven't seen the trailer yet?
Former sprint queen Ashwini Nachappa said it would be interesting to see whether IOA abide by the IOCs dictate.
The BJP had demanded action against them.
Uncertain still
Its price is lower.
BJP leaders trailing currently
Another Rs 3.22 lakh has been sanctioned for Bajrang Punia and Sumit for their training and tournament participation in Turkey.
"Thus, the issue is very simple."
Prime Minister Narendra Modi and Uttar Pradesh Governor Ram Naik expressed their condolences to the families of the deceased and injured.
These accounts are used to transfer foreign income in India.
"The name Nagpur is probably taken from Nagvanshi, who ruled in this part of the country."
Beauty & the booty
Presently his monthly income is Rs.
Natural elements
Later the workers called off the strike.
"The film has earned Rs 6 crore on its opening day, say reports."
"Kamla Retreat is a popular tourist resort in Kanpur which was built by Shri Padam Pat Singhania, an eminent industrialist of India, in the year 1960"
"At the time, Jaitley was a minister in the Atal Bihari Vajpayee government."
The Indian Space Research Organisation (ISRO) has opened online registration to witness the launch of Chandrayaan-2.
700 crore assistance to Kerala.
Prevention and treatment
Chief Minister said.
"For though I made you sorry with my letter, I do not regret it, though I did regret it. For I see that my letter made you sorry, though just for a while."
"We should not damage public property, he said."
The bomb attack at the Manchester Arena killed 22 people and injured 64 others.
"Some large bays, such as the Bay of Bengal and Hudson Bay, have varied marine geology."
The parents agreed.
Greek tragedy
This helps dissolve kidney stones.
In Jaipur
He recently quit the BJP and joined the Congress party.
He has one daughter.
Cumin fried lamb
Also Read: How many []
Mountains or Beaches?
But the money we get is meagre compared with other states.
"That which I speak, I don't speak according to the Lord, but as in foolishness, in this confidence of boasting."
Siddaramaiah himself has clarified on the matter.
Teachers have friendly relations with students.
Senior police officers reached and inspected the spot.
376 IPC punishes rape and
I have no information about his resignation.
"As per the reports, Katrina portrays the character of an actress struggling with alcoholism in the movie."
Should My Child Go to School?
For more information check out the link below.
This is not meant to be eaten.
Ram knew that.
But not I.
my likes and interests
Status of women
Sharing information
"""Now you say, 'Go, tell your lord, """"Behold, Elijah is here.""""'"""
The car has been seized.
"They have ears, but they hear not. neither is there any breath in their mouths."
Opening a bank branch is easy.
Net interest income (NII)
"However, she did not budge."
We didn't know anything.
Farmers clamour for demands
Viral video:
Nobody ever loved me.
A few remained.
He has also played county cricket.
"However, the rainfall was not unexpected."
The people living on the banks of the river were shifted to safer places.
JDS-Congress bittersweet relationship
Situation in south Kashmir is far from normal.
The film has not been shot yet.
Do comment in the section below.
Are you disappointed with the process?
Turns out thats not true.
Simply staying in shallow spiritual waters by being content with the elementary things of the sacred pronouncements of God hinders our advancement and may even invite shipwreck concerning [our] faith.
Open Heart surgery
"Maharashtra Assembly Polls: Elections will be held in 288 Assembly constituencies of Maharashtra where 3,237 candidates, including 235 women, are in the fray."
"Ram Charan, Jr. NTR, Alia Bhatt, Samuthirakani, Ajay Devgn are the main cast of this most awaited film."
"""Ashok Gehlot said, """"Some people are, intentionally or unknowingly, indulging in mischief regarding the situation in Kota."""
Hope people are going to like it.
I like it.
Dont look down upon govt schools
"For example, Solaris 2.4 incorporates SunOS 5.4."
There is no other option in politics.
Virat Kohli engaged in a candid conversation with teammates Kedar Jadhav and Kuldeep Yadav during the innings break.
No need for empathy or even kindness.
are being examined.
99 onwards.
Benefits of blue tea
He hadnt even finished school.
He even asked for a compensation for the victims family.
The cow died on the spot.
"Wrestler Yogeshwar Dutt will be contesting from Baroda, ex-hockey captain Sandeep Singh from Pehowa, and wrestler Babita Phogat will contest from Dadri."
Child Protection
4 - Getting run-down
"The woman was dressed in purple and scarlet, and decked with gold and precious stones and pearls, having in her hand a golden cup full of abominations and the impurities of the sexual immorality of the earth."
The BJP is in power in the Centre and in the state.
"joy, peace and happiness!"
"Actor Sanjay Dutt , along with wife Maanayata Dutt too hosted a glitzy Diwali party at their residence."
CMs meeting
And the day did come.
"The Pakistan hockey team is in Pool B, which include Bangladesh, Thailand, Malaysia, Oman and host Indonesia."
"The Modi government has, however, taken a decision."
Preparation of the drink is very simple.
But for most people it is not.
10 and No.
I dont know this name.
"If both of us happened to be at home, loud quarrels often erupted."
"Suddenly, a loud boom echoed."
The film has Sridhar V Sambrams music and Abhishek Kasargods cinematography.
Procedure: Take a saucepan.
"Therefore snares are around you. Sudden fear troubles you,"
But that would need more time.
"Also, the actor has a huge fan-base."
"First, money."
There was only one person who was injured in the attack
The process will be effective from 2018.
They build homes.
"""""""Around three to four suspects attempted to enter the consulate,"""" eyewitnesses said"""
Independents won in three seats.
But I am wrong.
How marvelous!
Memories of his...
"However, the Election Commission has already announced the dates for the elections."
Congress should come to power.
He is under treatment in the intensive care unit.
Jainarayan Sharma
All of them get salaries.
Take off from heat and allow to cool.
"During Atal Bihari Vajpayees regime, he was the Deputy PM."
How to make
The leaves are dark green on the upper surface and pale green on the lower surface.
"Further research is needed, the statement said."
"God admonished Israel to put away her fornication, but she wanted to go after those passionately loving her."
Hindu temple vandalised in US in hate crime
All flights were cancelled for the day.
"""How long will they wait?"""""""
"He was the third, after Rahul Gandhi."
They are not accessible.
On the central government
The value of rupee has fallen.
It is not wrong.
They have no objection to it.
The revenue from GST will be shared equally between the Centre and states.
This was a glaring example of misuse of the law.
Congress government started selling online liquor.
"This initiative will help many developing countries, from Africa to South America, to take advantage of developments in renewable energy around the world."
"The fact is, though, that all of us value obedience in our everyday life."
Shashi Tharoor: It seems safer in many places to be a cow than a Muslim
A spectrum of all the frequencies of absorption in a sample is recorded.
This isnt the only example.
The TCL 4K AI TV comes in two sizes (55-inch and 65-inch) and supports virtual assistants Amazon Alexa and Google Assistant.
You work for money only.
The answer is within us.
Nothing can be done without hardwork.
Special prayers were offered.
He was taken into judicial custody.
All had a wonderful time celebrating Christmas.
Look after your parent's health.
Who allowed this?
"In fact, the same things in the way of sufferings are being accomplished in the entire association of [our] brothers in the world."
"Furthermore, NIA has started investigation in the case."
Rates differ from state to state due to differential local sales tax or VAT rates.
This contributes greatly to weight loss.
But it is still unclear who all will attend.
Weathermen have cautioned people to remain alert as more lightning strikes are expected over the next couple of days.
He informed that the investigation is on.
A number of trade union leaders participated in the protest.
You will get profit opportunities.
Long-standing discussion
The movie is titled as Shadaa.
When is it releasing?
When & where
"Red alerts have been issued for Idukki, Malappuram, Kozhikode & Wayanad districts."
National Sports Day:
He was one of the founding leaders of the Kerala Congress.
The train had halted by then.
Tourists in large numbers visit here to witness the architectural excellence of these temples
But the Opposition parties do not.
It will be paid by the State Government.
They accuse him of lying.
He is swayed by a variety of social and political problems.
I havent looked back since.
"However, he was in for a big disappointment there, too."
It really helps me.
Nirav Modi Arrest
How to Register A Legal Heir in Income Tax Site?
He defeated BJP's Sunil Kumar Yadav.
"Start on your hands and knees, aligning your wrists underneath your shoulders and your knees underneath your hips."
BMW X4 Launched At Rs 60.6 Lakh
But its purpose was different.
"Each thali costs 2,500."
Dhanush: No!
It was shelved.
Chennaveerappa and others were present.
Its a boy.
Law and Justice
KVIC has 2400 active khadi institutions and this action alone will provide 12 lakh masks across the country
But we are investigating.
"He says, I love shoes!"
But it was entirely unobtrusive.
"But, this is all false."
"Modi said LPG is the cleanest and easily available source of energy that is giving women a healthier lifestyle, saving them time, helping them financially and saving the environment."
"Im fortunate that I got the opportunity to bow down to brave soldiers, to offer tribute to brave soldiers of this country on this historic occasion by coming amongst you."
Kumaraswamy also made a similar plea to Prime Minister Narendra Modi.
Cost for the ride:
"True, some responsibilities are assigned to a few within the Christian congregation."
It works with devices running at least Android 4.3 (Jelly Bean).
Awareness among people has to be generated in this regard.
Obesity causes many ailments.
COVID-19: India now seventh worst-hit country in world
It has been communicated to government.
"""""""WhatsApp should work in a coordinated manner with IT Department, Home Ministry and the police,"""" he said."""
All depends on the procedure.
The Swachh Bharat Mission Gramin has made rapid progress in advancing sanitation in rural India.
The officers were informed.
The state capital has so far remained a BJP bastion.
"The fund has investments in shares of HDFC Bank, ICIC Bank, Infosys, HDFC and ITC, among its top 5 picks."
Cauvery river
The polling was so far by and large peaceful and there was no report of any untoward incident.
Its demeaning to women.
"Hailstorm, heavy rain lash Bangalore"
Speaking to media.
The court dismissed the suit.
