"The hit lyrics of the song has been written by Yogaraj Bhat , composed by Arjun Janya and sung by Vijay Prakash."
Salman Khan hit-and-run case: Mumbai court cancels arrest warrant against the actor
Zilla Panchayat Chief Executive Officer Dr KN Vijayaprakash presided over the function.
Star Wars: Tap into the Force
Kindness and courtesy.
What exactly is India?
I have decided.
"This led to the closure of hotels, resorts and safaris in Bhadra, Bhagamandala, K Gudi and Dubare."
Solar energy should be used maximum.
Water flows unceasingly.
He(Modi) knows that he will lose the elections and that is why his face has turned pale.
What size should the napkins be?
So exams are necessary.
"Fans, meanwhile, want Tom Hardy to replace Craig in the next film and West is okay with that choice too."
Better taxation
"They all hold swords, being expert in war: every man hath his sword upon his thigh because of fear in the night."
"For example, sample these:"
participated in discussions.
"But after several months, my relatives found me and pressured the soldiers to return me to my village."
Several memes are circulating on social media.
The election for Jayanagar seat was also postponed after the death of BJP candidate BN Vijaya Kumar.
Theres nothing in it.
"Not pointedly, at least."
Do you not agree that applying these principles will reduce a significant risk to ones life?
The journey begins!
"However, the company is yet to make an official statement on this."
"To be heard, we must pray only to the God of the Bible, Jehovah, * not to any other god or to ancestors."
He has been provided security.
I was elected by the people.
"Apple launched its much awaited iPhone 11 series comprising of iPhone 11, iPhone 11 Pro and iPhone 11 Pro Max earlier this week."
RBI Banking
"Nalin Kumar Kateel, MP, Dakshina Kannada, inaugurated the Kendra."
Why? Artwork fuels our imagination and helps us to see ourselves enjoying the reality of these promised blessings.
Finding the Truth in Those Booklets
"However, authorities do not appear to have enforced that rule."
The length of his reign is unknown.
You will feel amazing peace and satisfaction.
Why is this so?
Nature is like that.
"Afterward, he deeply regretted his crimes, and God forgave him."
What economic crisis?
That is what we are so angry about.
You will get success in love affair.
The president of the S.D.
But I was! Release and a Move to Kazakhstan
What does a red ribbon symbolise?
There cannot be a change.
Im thankful for that.
Note the contrast between Jesus and the Pharisees.
So what is the reason?
Its all real.
Several awards
The residents have urged the administration to make arrangements for the disposal of water.
Curd 4 tbsp
West Asian Football Federation Championship
Some large firms sell computers containing preinstalled and licensed programs.
It comes in four colours.
His strategy is different.
Modi is no threat.
Footpaths and roads have been relaid.
25 MP front camera
And then the fifth one is running it on the data and answering the original question.
Hectic political activities are happening in the state.
Have you seen?
Total: 31.60 cr.
His love moved him to feel pity for them.
Or are we?
Life is strange.
But what of politics?
100 thereafter.
"I wish Narendra Modi becomes PM again, says Samajwadi Party leader Mulayam Singh Yadav"
Its not a simple answer.
"""Mahatma Gandhi called him """"The Maker of Modern India""""."""
Or should you not?
After it an array of dance programmes was performed by the school students.
At first it was Rs 1 crore.
"Karnataka has been demanding that the prime minister call a meeting of the chief ministers of riparian states of Maharashtra, Goa and Karnataka to resolve the Mahadayi dispute."
"From harboring Osama bin Laden to its cozy relationship with the Haqqani network, there is more than enough evidence to determine whose side Pakistan is on in the War on Terror."
This is usually not done.
(See box for details).
"Achyuth Kumar, Balaji Manohar, Pramod Shetty are part of the supporting cast."
"Nevertheless, I hold this against you, that you have left the love you had at first. Rev."
I definitely have.
Unknown error.
SBI halts debt sale
he asked on Twitter.
"Special buses from Mysuru Road Bus Station will be operated towards Mysuru, Hunsur, Virajpet, Kushalanagar, Madikeri, etc."
The Election Commission had earlier declared invalid two votes by Congress MLAs who had cross-voted.
Is it the story?
"Gods Word assures us: The generous soul will itself be made fat, and the one freely watering others will himself also be freely watered. Proverbs 11: 25."
Each layer is left to dry before the next one is laid.
Not likely!
They are low in calories and rich in nutrients.
Processed food
It just requires a little effort and time.
He clarified that there is no familial quarrels in his family.
"""""""There is a revolution happening at every nook and corner."""
They had shared the pictures on social media.
PM Modi and Home Minister Amit Shah
Food Grains
Everybody has to abide by the partys decision.
The photo immediately went viral.
Students will get better results.
Ranbir Kapoor is a tremendous actor.
Businesses also gain.
Text of the expander's label
"It is directed by Rahul Ravindran and is co-produced by Annapurna Studios, Manam Enterprises, Viacom 18 Studios and Anandi Art Creations."
Ganguly had 11 Test wins from 28 matches.
The police have arrested the woman.
Thats our job!
"Price, offers, variants"
Wash with water.
"He left his wife, a daughter and a son."
"Even more sobering, 98 percent of that growth during the next two decades is forecast to occur in developing countries."
Jesus will come to settle accounts with his slaves toward the end of the great tribulation just ahead.
The festival was celebrated with a grate joy in the district.
India have won a Test series in England only three times.
A man is no different.
Gupta were present.
"We have our own history, culture and identity."
"And he said unto them, Ye will surely say unto me this proverb, Physician, heal thyself: whatsoever we have heard done in Capernaum, do also here in thy country."
Result is as follows:
Serotonin: This helps in negating pain and elevating a good mood.
I decided to find out.
The appointment makes Kumble the only Indian coach in the IPL
Ministers should refrain from giving such statements.
I want to play cricket again.
Family members have told the police that the deceased was a habitual drinker and died due to heavy consumption of liquor.
"This is not the way among you. but whoever wants to become great among you must be your minister. Matthew 20: 25, 26."
Rahul Gandhi releases Congress Manifesto in Mangaluru
Others cry.
The telephone rang.
Those days were entirely different.
What a great time that was!
Whats causing that ache?
Declutter often.
Education plays a significant role in the development of a country.
How do you make your eyes look bigger?
Nobody should fear.
Suresh Prabhu: Minister of Commerce and Industry.
Mahesh Sharma was also involved in this team.
A premium subsidy of 75 per cent to be given in case of small and marginal farmers and 50 per cent for other farmers.
No increase in prices
This had soured their relations.
About Thanksgiving
Increase in life
"He stressed the need for comprehensive and all-round development of the nation, and especially the eastern part of the country."
We just need to give it all in.
"It must be acknowledged, however, that many who recite the Lords Prayer do not fully understand it."
They have no opportunity.
We cannot defy the Supreme Court ban.
Gently dab the cloth on the skin.
"Following the double murder, Pasha moved his wife and children from Hunsur to a house in Mysuru."
He has demanded a CBI inquiry into this.
You can pick what you want.
The dragonfly needs an umbrella.
Kejriwal govt to make travel in Delhi Metro and DTC buses free for women
He appealed to everyone to maintain peace and harmony.
Train and bus routes were closed.
We tried reaching him.
The oil spill covers 360 sq.
"""Then king David answered, """"Call to me Bathsheba."""" She came into the king's presence, and stood before the king."""
"The 34-year-old Dhoni, who first led India in a T20I in 2007, has won more than 50 per cent of the matches as a skipper"
A case has been registered at the Udupi Town Police Station.
The new Swift is expected to have 1.2-litre K-series petrol engine and 1.3-litre DDiS diesel engine.
IOC president Thomas Bach called Russias actions a shocking and unprecedented attack on the integrity of sport and on the Olympic Games.
Shri Ambareesh will always be remembered for his memorable performances as an actor and extensive contribution to politics.
What to do madam?
BJP-JDU power tussle
Who are eligible for the scheme?
Alternative greeting text.
"In rural areas, both men and women are primarily self-employed, mostly in agriculture."
This is the latest example.
But the government is not keen.
A passerby filmed the incident on his mobile phone and uploaded the video to social media.
"The government has already released a grant of Rs 1,300 crore for the implementation of irrigation projects in Shikaripur and Sorab taluks in the district."
This has happened many times in history.
The target was obvious.
There should be cordial and harmonious relationship between the Centre and the State.
But he was in for a surprise.
Lets try again.
"Showers lashed Yellapur, Haliyal, Sirsi and Siddapur taluks of Uttara Kannada district."
"There were around 45 passengers on the bus, which was en route to Motihari in Bihar from Delhi."
And there are rules.
"Basavaraju, Zilla Panchayat Members Manjunath, Rajendra, Rudramma Nagaiah, Taluk Panchayat President Nirupama Rajesh, Assistant Commissioner Veena,Tahsildar N. Shweta and Taluk Panchayat Executive Officer Shruti were present."
He also demanded NIA probe into the incident.
But not so anymore.
BCCI had objected strongly to this clause.
We are mad about them.
Prefects of Pilates rank were usually sent to barbarous territories. The Romans considered Judaea to be such a place.
2200 crore.
The activists of the organization shouted various slogans against the Central Government and slammed Prime Minister Narendra Modi.
"Aerospace Engineering, Applied Mechanics, Bio Technology, Chemical Engineering, Civil Engineering, Computer Science and Engineering, Engineering Design, Electrical Engineering, Mechanical Engineering, Metallurgical and Materials Engineering, Ocean Engineering."
PMs departure statement ahead of his visit to Thailand
"Based on the complaint, the police have booked cases under section 295 A and 153 A of the Indian Penal Code and an FIR has been filed at the Honnali JMFC court."
His able commander Lakkanna invaded Ceylon and collected rich tributes there.
Anil Ambani was spotted casting his vote in Mumbai
The Tejas Express train on the Delhi-Lucknow route is likely to become the first train which is to be operated by private entities.
How can I be responsible for that?
Growing plants without soil?
Strip off the old personality with its practices. COL.
Upper age limit is
"You shall diligently keep the commandments of Yahweh your God, and his testimonies, and his statutes, which he has commanded you."
"It contains vitamins A, C and E, antioxidants, and fibre."
Another accused person was absconding.
"The BJP will win all 15 segments in the byelection, he said."
Skin rash:
Aparna Yadav is the wife of Mulayam Singhs second son Pratheek.
The Indian-Americans will put pressure and use the political clout to impress upon the US the importance of a balanced and fair trade agreement with India.
Anil was immediately rushed to the hospital.
The Congress had alleged the move to be unconstitutional.
There are rules for everything.
They are both very good friends.
It represents their empowerment.
Who was responsible for the incident?
Everything has to be just so.
Virat Kohli named captain of World T20 Team Of The Tournament
No need for timing the markets: No need to select the right time and quantity to buy and sell as timing the market is time consuming and risky.
"Our weavers and the people working in textile, who make yarn and yarn rolls, used to get Rs.100.We have increased that to Rs.190 so as to strengthen the hands of my yarn producing mothers and Sisters."
Iran seizes British Tanker. Indians onboard among 23 seafarers
Also in Kannada
Much still needs to be done in the sphere of development.
"Unfortunately, the offer is available only in seven cities, they are Ahmedabad, Bangalore, Delhi-NCR, Hyderabad, Kolkata, Mumbai, and Pune"
"Otherwise, you resign."
Tippling tips
"But it has been revived by the Prime Minister, especially through his speeches."
"We will consider how he uses them to strengthen and protect his people, to deliver messages to humans, and to execute his judgment upon the wicked."
"Karnataka Examinations Authority (KEA) conducts Karnataka Common Entrance Test (KCET) for admissions to engineering, agriculture, pharmacy and various other courses."
"But Czechs and Romanies (Gypsies) also played an important role, as did the Jewish community."
The detail of winners is as below.
The case was investigated by the CBI.
How do we rectify this terrible system?
"Nausea, vomiting, abdominal discomfort and diarrhea."
What is gratuity?
"There are, however, certain rules one must keep in mind."
BCCI got permission for it.
It contains natural antioxidants.
Abdomen pain
"This is the only event that Christians are commanded to memorialize. 1 Corinthians 11: 24, The Jerusalem Bible."
The residents have urged the authorities concerned to take action and solve the problem.
Here are some lines:
You don't know.
The time has not yet come to answer your question.
What took place in connection with the daughter of Jairus?
Google is using the same Sony IMX363 sensor as on the Pixel 3 series.
(Who are the Urban Naxals?
How to make the Christmas pudding?
"Recently, the Darul Uloom Deoband in Uttar Pradeshs Saharanpur, one of the largest Islamic seminaries in India, issued a fatwa that bans Muslims from posting pictures on social media sites and termed the act un-Islamic."
Types of Entrances Entrance
But what about Shiva?
"Unfortunately for her, that wasn't to be."
In first phase
Lets continue:
Several organisations have honoured and awarded her.
It is an adventurous life.
"However, he seemed in discomfort initially in the second game."
There is plenty of evidence for this.
"Nevertheless, they all have APL ration cards."
The Sanjay Dutt biopic is directed by Rajkumar Hirani.
"However, people dont understand this."
You will do this?
"If you dont, youre dead."
"Off the 52 ODIs Down Under, Australia have been victorious on 37 occasions, while India have won only 13"
Work is being done.
I have carried out a number of development projects in the area.
"It is located in near Phura village in Saiha district, within the Mara Autonomous District Council."
But he did nothing.
Doctors said the girls condition is serious.
GNOME Bluetooth home page
Not all patients will have the same symptoms.
"After Tharoor's 'Hindi, Hindu, Hindutva' tweet, BJP accuses Congress of insulting Hinduism"
His popularity soared.
"Taiwan's democracy under threat from China, says President Tsai Ing-wen"
"They also exercised faith in the Universal Sovereign, Jehovah God."
Good morning readers
The report for this is being prepared.
India will play Pakistan in their next match.
This brothers problems began to subside after he accepted a personal Bible study.
From ours to yours
"The Centre for Fire Explosive & Environment Safety (CFEES), Delhi has developed two configurations of sanitising equipment"
Rupee as against Wednesday's close of 71.24 is trading lower at 71.38 per US dollar.
The girl lodged a complaint with police against the youth.
Congress manifesto:
That gave us the victory.
"This happened at about 1.45pm, he added."
Donald Trump and PM Narendra Modi
"Other states include Orissa, Assam, Rajasthan, Madhya Pradesh and Bihar."
The Supreme Court has already given the judgement.
How dare you say so?
Send me back.
"To do this, follow the steps below:"
"That film's success renewed interest in the then-moribund Western musical genre, subsequently fuelling a renaissance."
"John Emsley, a science writer at Imperial College, in London, England, said that it is one of the most investigated of all chemicals, but it is still the least understood."
"Farmer leaders Lokesh Raje Urs, Hosur Kumar, Hoskote Basavaraju, P. Marankaiah, Netravathi and others were present."
"Violence, murders, rapes etc."
Hanuman Jayanti celebrated
What were your thoughts about the origin of life?
Data source type
Add butter.
Increased salivation
"""""""We are making some mistakes that we will try to fix"""
Not if we grasp the main reason why God sent his Son to the earth.
"He is survived by wife, two sons, parents, three sisters and a brother."
A post shared by David Beckham (@davidbeckham)
Shake well
"Meanwhile, England and Wales Cricket Board (ECB) will name the squad for first two Test matches against India on Thursday"
The government has undertaken a Rurban (Rural and Urban) mission.
Endure under tribulation. Persevere in prayer. Romans 12: 12.
Talk about rights.
Everyone should become friends.
It comes with Windows 10 pre-installed.
This brings the total reported cases of coronavirus in Kerala to 524
Ministers and legislators were among those who spoke on the occasion.
Mehta said the migration of people cannot be allowed at this juncture as this would spread the virus.
But what exactly is fake news?
Ukrainian plane carrying 180 passengers crashes near Tehran
"The songs have been sung by K. J Yesudas,Vijay Yesudas,Shankar Mahadevan,Chitra and Sadhana Sargam in Hindi and Telugu."
Were reviewing the situation.
And we can be confident that God will not let us be tempted beyond what we can bear. Read 1 Corinthians 10: 13.
WHY WERE JUDGES NEEDED?
IPL 2019: Virat Kohli becomes top scorer in Indian Premier League
Reserve Bank of India (RBI) Governor Raghuram Rajan.
Work is being done.
See Pictures Here
But I was confident of a victory.
Long-term investment
There was gloom everywhere.
Many houses have collapsed.
Never in history has this happened.
I had everything.
Don't vote for them.
More than 350 people were killed.
Well smile.
"Later, a cultural programme was presented by students of various schools."
"Even when we went to ask the doctor, he was with me."
"Concerning Alexander VIs morals, one historian of Borgias day wrote: His style of life was dissolute."
Say what you want.
He has his own ways.
"""""""The Government punishes every crime."""
for quite sometime.
Such exceptions are frequently made.
The exact reason for the death of the leopard is not yet known.
Only we do it.
I wont comment on this.
relatives & friends
Every character in the film has a story of its own.
Rs 310 crore has been earmarked for farmers for buying agricultural implements.
"Till date, 11 Day-Night matches have been played and all the games resulted in a winner."
This is salvation.
a few rose petals
in Australia
"I was happy, I went to them, and three of us sat together."
36 per cent.
I am going to leave the party.
No complaint had been lodged with the police in this regard.
"A kitchen, a living room and a bedroom."
DM-Neurology
2 lakh compensation
Introduction of Complaint Portal for the use of port users.
Indian cricket team captain Virat Kohli is on the verge of breaking yet another massive record.
A quarrel took place between the couple.
That means about Rs.
It takes 40 to 50 years for a tree to reach full growth normally a height of from six to ten feet [2 - 3 m].
"""""""Let's do something."""
There is no toilet.
It's certainly not about the coaches
A case has been registered against the accused at Seshadripuram police station.
He hadnt made any money.
Ill speak to Ahmed Patel.
"Chief Minister Nitish Kumar and alliance partner Lalu Prasad Yadav attended the rally at Gandhi maidan in Patna, as did members of legislative assembly from both the Congress and the Bharatiya Janata Party."
"The Gambia (/mbi/ (listen). Mandinka: Kambiya . Wolof: Gmbi, Fula: Gammbi ), officially the Republic of The Gambia, is a country in West Africa."
The temple is one of the few dedicated to Lord Shiva in a town which is closely associated with Lord Krishna
"A large number of farmers, including women, participated in the dharna."
Politics has changed.
Magazines can be downloaded automatically for offline reading.
are all useful.
"For example, much Bible - based guidance is provided in the series Young People Ask... and The Bibles Viewpoint, which will remain regular features of this journal. In addition, Awake!"
"BN Prahlad is BN Vijaykumars brother, while Congress candidate Sowmya Reddy is the daughter of former minister Ramalinga Reddy."
This is a very difficult balance to maintain.
Cannot be said.
Why do children need to cry?
It was too late!
Rahul achieved the second spot on the rankings with 823 points.
This key specifies how many rows (for horizontal layout) or columns (for vertical layout) the workspace switcher shows the workspaces in. This key is only relevant if the display_all_workspaces key is true.
I am getting married.
They are women.
An elder showed me how to prepare myself and be more relaxed.
"When we wrote the first draft, Karnad read it and said, There is nothing here for women."
Communications Minister Manoj Sinha.
This has made the life of the people miserable.
Why did
Diwali is the festival of lights.
Chief Minister Siddaramaiah will inaugurate the function.
A lot of it.
"India and Pakistan are slowly increasing the size and diversity of their nuclear forces, the statement also read"
Before we go
USED up at the end of the workday.
Error deleting pool '%s'
She didnt touch it.
"Therefore, a vital part of a shepherds job is to provide water for his flock."
This will improve the health of your uterus.
In these circumstances where:
COVID -19 Economic Response Task Force
The girl reported the matter to her father.
What commendations and exhortations did Jesus give to the Christians in Smyrna and Philadelphia?
"I am not inclined to grant bail, Justice Kait said."
Summer sets in.
The voters are not given bribe.
Few of the injured passengers are said to be in a critical condition and they have been shifted to Ranchi for further treatment.
"They include vegetables, pulses, cereals, fruits and rice."
I am proud that my work is helping in doing so.
The difference between the two products?
Nothing more to be done.
Good news for motorists!
There was no use.
Incestuous relationship
New Delhi: What is swadeshi?
I admit what was done was wrong.
But the commission refused to disclose the information.
On Rahul Gandhi
What are your thoughts about India?
"""""""PM Said This Event Will Be The Biggest"""": Trump Before Leaving For India"""
I was again made to think.
34 billion.
A fine way for us to demonstrate that the law of loving - kindness is upon our tongue is that we speak consolingly to the depressed souls. 1 Thess.
"Bill, mentioned earlier, says about the years when he wanted to marry: They passed so quickly!"
"Eeee, someone was wailing."
"India can beat any team, says Wright"
Women are an integral part of a society.
Your health will be perfectly all right.
No guesses.
"""""""The Indian public takes keen interest in shooting events involving Indian shooters."""
"Unless I like it, I wont do it."
It surely will.
"""It will Be Served."""""""
"Hence, large black holes emit less radiation than small black holes."
"The film, an Ali Abbas Zafar directorial, stars Salman Khan in the lead role."
Not me
Where have you gone?
It also elevates the blood pressure.
"""""""We couldn't find even a single file that specifies the previous government's efforts to construct the temple,"""" Sharma said."""
I had rented out my house.
"Rs8,000 crore"
But Krishna declined for this.
"50, pepper Rs."
"The saints and seers of Gujarat have played a very big role in the making of the Sardar Sarovar Dam, he said."
Woman murdered
No information given on that.
Some molecules are composed of thousands of atoms of many of the 88 elements that occur naturally on earth.
Method of preparation:
Pate said.
"He made his son to pass through the fire, and practiced sorcery, and used enchantments, and dealt with those who had familiar spirits, and with wizards: he worked much evil in the sight of Yahweh, to provoke him to anger."
The proposed Act
Submit Query
Sometimes theres a crackdown.
Bollywood actor Salman Khan.
The government has to answer our questions.
Apple Inc hasnt commented on that.
"""Finance Minister Arun Jaitley has rubbished as false the statement of Vijay Mallya wherein he claimed that he had """"met the Finance Minister"""" before he left India."""
It is part of our daily diet.
Is he political?
This prospect undoubtedly gives the anointed Christians yet on earth strength to brace up their minds for continued activity. 1 Pet. 1: 13.
I am so tired!
Producer: Anand Prasad
It doesn't feel that way.
"Plus, its easy to clean."
colon cancer
Freshly grated coconut - 1 cup
Australia win
I have come back after a few months.
Ghee - 100 grams
"Go, report to my brothers, that they may go off into Galilee. and there they will see me."
"We can gain a measure of tranquillity by pouring out our concerns to our heavenly Father. In fact, he encourages us to do so."
Rs 23 Lakh
Former Chief Minister Mehbooba Mufti
"He is also a songwriter, producer and actor."
