"Thus saith the LORD, the God of Israel. Like these good figs, so will I acknowledge them that are carried away captive of Judah, whom I have sent out of this place into the land of the Chaldeans for their good."
The injured were admitted to Army Hospital.
Rajasthan assembly polls: BJP picks probable candidates
"""It is vitally important to develop a strategy that advances defence cooperation between our two nations,"""" Bera said."""
"Earlier, Facebook bought WhatsApp."
TDP MPs protest at Parliament
Others believe it isnt.
"Add the flour, oats, baking soda and salt."
Parents were excited
"And Jesus said unto them, Come ye after me, and I will make you to become fishers of men."
Consumer demand has plunged.
"He and Pratyush (143 not out, 26x4) shared a massive 213-run partnership for the 4th wicket"
I love the beach.
What a pair!
We don't have that.
We want to live in peace and harmony with our all neighbours.
Former CBI chief Nageswara Rao slammed for calling Swami Agniveshs death 'good riddance
"KL Rahul contributed 39 runs off 26 balls, inclusive of three sixes and two fours."
The human rebels called into question whether Jehovah properly exercised his rulership over his creatures.
The darkness was thick.
I mostly eat grilled food.
"Andrew Brennan was an advocate of ecologic humanism (eco-humanism), the argument that all ontological entities, animate and inanimate, can be given ethical worth purely on the basis that they exist."
Large deal wins were USD 2.8 billion.
The meeting was held at BJP State headquarters.
"At my first humble attempt to share in house - to - house preaching, I simply told the householder that I was selling nice religious books and offered The Harp of God, a book that explained ten important teachings of the Bible, likening them to ten strings on a harp."
State BJP chief BS Yeddyurappa lashed out at the chief minister over the incident.
"We lack basic facilities such as roads, water, and sanitation."
Distressed Wife
"The English ruling class created an independent and professional police force, thereby bestowing the police with the legitimacy to maintain order."
I do believe that is not my India.
Starting a new business
The government did not help at all.
"Houses, streets and churches get decorated with colourful items and lights."
Price: Rs 5.24 lakh.
The nationwide lockdown also meant that all state borders would be closed for the entire 21-day period
1 lakh on his arrest.
"Democracy, Liberty, Equality and Justice"
Vacancies:04
Locals took him to the hospital.
At the same time a truck coming from behind hit the bus.
We have been backward.
The truth usually lies somewhere in between.
It also helps to remove tan.
It also helps stimulate milk production during breastfeeding.
The villagers protested.
"Moreover, it is very easy to put together."
She had little control over the first and none at all over the second.
Thus he applies Pauls words: Let us pursue the things making for peace and the things that are upbuilding to one another. Romans 14: 19.
We are supportive of them.
But there's a hiccup
We cannot do more than that.
"The winners will be given cash prizes, certificates and accolades."
But I dont want to get things easy.
You cant fix it.
No medicines are prescribed.
Whats a president to do?
Some people are feared trapped.
"""""""For BJP, politics is more important than people."""
Dont alienate
Lets wait and see what they decide.
"They were impressed with the loving Christian brotherhood, and what they observed among the brothers drew them to Jehovah. John 13: 34, 35."
He was very happy.
"The country recorded as many as 9,985 cases in the last 24 hours"
So there was no question of any pressure.
"Yes, in spite of difficulties and drawbacks, thousands of dedicated women and men are drawn to the teaching profession."
This is true in a way.
"The state's main opposition party - the Congress, on its part, claimed that its performance this time will be much better than its 2014 election show."
Agri activities regain momentum after heavy rainfall
Mayank Agarwal has been roped in as a replacement for Vijay Shankar in the Indian squad
"The film, based on the life of Patna-based mathematician Anand Kumar, is directed by Vikas Bahl"
Delhi: Mortal remains of Former Union Minister and Bharatiya Janata Party leader (BJP) Arun Jaitley being taken to BJP headquarters.
"However, they werent."
They didnt need to be whipped.
"The air that we breathe, the food we eat and water we drink, all these come from nature."
The BJP failed in its bid to form the government in Karnataka.
His father was Kesana and his mother Lakkamamba.
"The Baal worshippers, however, did not give up."
They never misbehaved.
"If a fleece left on the threshing floor becomes wet with dew while the ground remains dry, this will indicate that God will save Israel through him."
Top 5 cars under Rs.
That operation was successful.
"1 / 1 For Young People, 1 / 1, 4 / 1, 7 / 1, 10 / 1"
After GST
"However, the Congress said that neither was released by the party."
He alleged that the authorities were misusing their powers in this regard.
Woman power!
"However there has not been any response from the government, he alleged."
Pandit Bhimsen Joshi's Awards
Section 144 prohibits assembly of more than four people in an area.
whither holidays?
Whether the application window should be maximized
It might be.
Is this a new thing?
There is no bigger joy than this.
"Coast Douglas-fir is about the same height. only coast redwood is taller, and they are conifers (gymnosperms)."
Home Sports Vinesh Phogat finishes with silver in Asian Wrestling Championship
It cannot be stopped or resisted.
"Syndicate Bank would merge with Canara Bank, and Andhra Bank and Corporation Bank would get amalgamated with Union Bank of India."
Srinagar: Two policemen guarding the court complex in Jammu and Kashmir's Pulwama district were killed in the wee hours of Tuesday in a terrorist attack.
Many love their work.
Karnataka government transfers 20 IPS officers in a major reshuffle
If you did not twinkle so.
"Rather, Paul explained: All Scripture is inspired of God and beneficial for teaching, for reproving, for setting things straight, for disciplining in righteousness, that the man of God may be fully competent, completely equipped for every good work."
Without it life cannot exist.
"However, the Centre had not yet accepted the demand."
"Sometimes, I make a complaint."
Don't I know it?
More police officials were deployed to control the traffic an officer said.
"""Select the search option """"Exclude other filesystems"""""""
What was at stake in this election?
"However, several new types of dyes had to be developed for more - modern synthetic materials such as acetate rayon, polyester, nylon, and acrylic fiber."
The display on the feature phone measures 2.4-inches with a 240x320px resolution.
Or it should leave.
This meeting
But that's necessary.
This is hilarious!
They have been produced in the court by the police.
"Kamal Haasan is currently the host of a reality show, Big Boss Tamil, which has become hugely popular."
Is this good for the country?
A favourite scene
Tiger Shroff is one of the most celebrated actors of the Hindi film industry at the moment.
Garlic: 6-7 cloves (finely chopped)
All my life
Seven fire brigade vehicles were rushed to spot to douse the blaze.
It is a truly global issue.
"If we once make strong resolve to take up the cleanliness drive, tourists visiting here from all over the world will return with a good memory of clean Kashi."
They are not a thing to play.
They demanded that the work be expedited at the earliest.
Large number of devotees from different parts of the country witnessed the pooja of the goddess.
What events similar to those in 66 C.E. will we soon face?
Reviews are mostly positive.
I didnt even know his name.
It is high in fibre and protein and also rich in antioxidants.
Why didnt the court rule so?
Arvind Kejriwal-led Aam Aadmi Party has already announced that it will contest the Gujarat Assembly polls.
It will be released soon.
The engine comes mated to a standard six-speed gearbox
Rajender Kumar said.
the message said.
Governing Body of Jehovahs Witnesses
Different development initiatives were taken up.
India Vs England: Test series
Drink a glass of skimmed milk every day.
It helps you relax and calm down.
Its fun and difficult at the same time.
"50 crores, totalling upto Rs."
Other factors:
CD Player
Most of the videos have been shot in Bengaluru.
Prime Minister Narendra Modi's reaction to Ayodhya verdict
The committee had submitted a number of reports highlighting irregularities.
"This was when Deepika Padukone was on a promotion spree for her upcoming film Chhapaak, where she played the role of a real-life acid attack victim Laxmi Agarwal"
He was the principal secretary to Prime Minister Narendra Modi during his tenure as Gujarat Chief Minister.
Pakistani cricketer Hasan Ali set to marry Indian woman
"Once a case is registered against them, their names will be made public."
Carter wins Nobel Peace Prize
Indian money in Swiss banks dips
This is extraordinary situation.
There was no debate.
"For the rest of the Rs 4,930 crore, 123 projects have been allocated for riverfront development, constructing ghats and cremation grounds, cleaning the river surface, tree planting, rural cleaning, etc."
Why is prayer essential to cope with temptation?
Look at Mumbai.
"Pouring into the lap refers to a custom of some vendors to fill the fold of a purchasers wide upper garment, which was bound with a girdle and made into a pouch for carrying items."
"With the elections nearing, campaigning has picked up pace."
It is not an escape from life.
The BJP too is not ceding an inch.
We have passed that time.
There are four such akharas in Bareilly
Missing something?
Lets wait and see
It was raining heavily at that time.
sexual assault
He had contested elections from Jamnagar West constituency on a BJP ticket and won.
"If you did, you could be viewed as an accomplice. Wisely, therefore, you would choose to walk away."
Three accused persons were arrested in this connection.
Which book by him is your favourite?
He said he was asleep when police came home.
"Jai Jagannath, the Prime Minister said."
4 December: Last date for filing nomination
What to grow?
The High Court's
The police are still investigating the case and no arrest has been made in this connection so far.
Whiskers are very sensitive.
He said that everyone will have to become united and work together.
This is the first plenary session of the party after Rahul Gandhis elevation as AICC president.
All schools do not have basic facilities.
Various reasons for this exist.
We cannot tolerate insult of our Mother.
He has also closely interacted with the BJP and the RSS.
About 9.58 lakh aspirants have registered for the exam to be conducted from September 1-6 across 660 testing centres
But what kind of technology ?
Assistant professors
Read the below-given details
[ Box on page 14]
Add two tablespoons of the spice mix and combine well.
But the Government has responded to criticism.
It is safe and non-traumatic.
"Pakistan recall Faheem Ashraf, Bilal Asif for Bangladesh Test"
How common is autism?
"For safety, the car gets dual front airbags, ABS with EBD, driver and co-driver seatbelt reminder, rear parking sensors, rear parking camera, front fog lamps, etc."
Kolar Rural Police have registered a case.
"Breathing difficulties, muscle pain."
"""There have been demands from various organisations in the Northeast as well as in Jammu and Kashmir for repealing the AFSPA, which, they allege, gives """"sweeping powers"""" to security forces."""
"""In his books, """"mash-up"""" and collage based mixes of authors, artists, and musicians such as Antonin Artaud, James Joyce, William S. Burroughs, and Raymond Scott were featured as part of a what he called """"literature of sound."""""""
The commission did not act on this.
There is a touch board.
"The interior is well laid out without neglecting everyday needs such as, a four-way adjustable driver seat, smart storage spaces like the centre console with bottle holders, a three-tiered glove box, and a power socket to charge your phone"
Here is the final list of players sold
Naqvi said.
"The situation is reportedly tense, sources said."
Five people died.
Donald Trump has won the race for the Republican nomination.
could be grown.
There is no teachers?
"He cruised the Red Sea inside the Bab al-Mandab, with the first European fleet to have sailed this route."
Rohit Sharma shone in T20Is too
The burglary incident has created fear among Delhi residents as Satyarthi's house is located in south Delhi's posh Alaknanda area.
Police team immediately rushed to the spot.
Why you are laughing?
How is this election different from the previous ones?
It is better to wait it out.
"Those making the recommendations are not to be unduly influenced by outward appearance, educational attainments, or natural abilities."
Siddaramaiah thought he would become CM again.
We honour the Supreme Court verdict.
How much is beautiful enough anyway?
"Raj Thackeray arrested in Ratnagiri, MNS on rampage"
"""""""It reminds us of the Emergency"""
Gandhi could not accept that.
She was very strong.
But it did not rain enough.
Connecting with viewers
"Ultimately, I said that there are clouds lets go ahead."
Let's see if we can get something done.
"It is not just Goa, it is the voice of every honest person in India."
The protest was peaceful.
No action has been taken by the authorities so far.
He is said to be upset.
History is replete with such instances.
Follow these instructions:
This will keep the skin from becoming dry.
Second is the month.
"Police had lodged an FIR against 200 people, including Naqvi."
More details are yet to be known.
Raghubar Das sworn in as Jharkhand chief minister
The Bird and The Girl
He scored a century in the second innings and was named man of the match.
I will try my best to discharge the responsibility given to me.
This key disables DirectX (on win32) and XVideo (on Linux) video hardware acceleration
The Constitution guarantees several fundamental rights to our citizens.
"""""""Modi's nationalism is fake."""
So it doesnt fall over.
And there are two reasons for that.
And were coming back again.
"Students, faculty and staff were present."
How can it not?
Eat foods with high water content
"However, the police was not informed."
"O Jehovah, during distress they have turned their attention to you. they have poured out a whisper of prayer when they had your disciplining. Isaiah 26: 15, 16."
Credible and capable bankers have been appointed to head banks.
These attempts are being done continuously by BJP leaders.
It wont take long.
Why and how its useful
The film was directed by Pawan Kripalani.
Patil was present.
I spoke to leaders of other parties also.
"In poetic language, the psalmist prophesies that the Kings arrows are sharp, piercing the hearts of his enemies and making peoples fall before him."
New records are being made.
Police have imposed a curfew in the area.
Chief Minister BS Yediyurappa has condoled the demise of Pundit Sudhakar Chaturvedi.
That's being investigated.
Kerala Govt favours entry of women to Sabarimala
His second innings performance came as a nightwatchman in order to shield other batsmen from the new ball late in the second day.
There is nothing wrong with calling a learned person a Brahmin.
"Cultivate Virtue, 1 / 15"
Many houses have collapsed.
This is a statutory requirement.
I told Brother Sullivan that my wife was spending as much time as I was in the ministry and that she would like to pioneer with me.
"After the Civil War, a coffee ship was designed here for trade with Brazil."
Launch settings
Teachers accompanied their students.
The exams will be held as per schedule.
Some companies have come forward to help.
Everyone is learning.
Simmer until vegetables are tender.
Treatment is quite simple.
"He that oppresseth the poor to increase his riches, and he that giveth to the rich, shall surely come to want."
That affects your mind.
Then something happened.
"Skoda Auto India has confirmed that the all new Skoda Karoq will launch in India during April 2020, and we could expect the car to be unveiled at the upcoming Delhi Auto Expo 2019"
What does she eat?
"Moreover, they have announced to form a new party, he said."
A case was registered under Indian Penal Code Section 324.
"""""""Work to revise the voters' list is going on."""
"Her health deteriorated after that, her husband said."
Apply online
Hold three to five breaths.
I'm excited because of that.
These people are elected.
Your efforts in work will bear fruits.
Theres a lot of research.
Best is yet to come.
Is it popular?
"Many parents have no option but to make use of day - care facilities, so they put extra effort into giving their child attention and affection when they are together."
Add a pinch of turmeric.
(currently on
There are no roads.
The likely gains are low
What you should watch out for
A third question followed.
Amit Shah asks 6 questions to opposition over EVM row
"Addressing the meeting, Prime Minister Sharif said Pakistan was ready to boost cooperation with the neighbouring India as part of counter-terrorism efforts."
Desktop Theme
What is your poetry about?
With Axis bank credit cards you can get 5% off.
How do I identify a khataara?
Because we love it.
There was chaos in the room.
The tentative dates are given below:
So there is no such problem.
Pregnant women need to be especially careful.
"Father poisons three children, kills himself"
Indias bowling is heavily dependent on the spinners.
50000 fine.
"The special cell of Delhi Police is also searching several locations in the Capital, reported ANI."
"In the report, BP was accused of nine faults."
Hes unassuming and emotional.
Oscars 2019: Rami Malek wins Best Actor for his performance in Bohemian Rhapsody
Mix it with spices.
of love
Our government is on move.
He won easily.
States are now in healthy competition to provide ease of business and infrastructure linkages.
The police filed a complaint.
Jehovah is not to blame for the enormous suffering that has existed for so long.
PM Modi not to fly over Pakistan while travelling to Bishkek
BJP uses police vehicle for food distribution
It is directed by Amar Kaushik.
And it's trending!
Dont be surprised.
"This is so because murmurers invariably voice their complaints, doubtless hoping that others will sympathize with them."
12 per cent.
Kajal Aggarwal shared this boomerang video of herself on her Instagram account.
This is the age to play.
"India are clubbed in Group-B in the world Cup alongwith Bangladesh, England, South Africa, West Indies, Ireland and The Netherlands."
Bring it down.
Love jihad commotion
I am lucky in this regard.
Tata Consultancy Services Ltd is Indias largest software exporter.
Do not share your personal information with anyone.
"True, they may not be as quick as you are at learning a computer program, but they know much more than you do about the wayward heart."
Four separate cases of theft were registered.
The bit is a basic unit of information in computing and digital communications.
"Maruti Suzuki is the biggest car brand in the Indian market, dominating over half the market share in the country"
"It gives 10,000 XP per Raid."
How should they be dealt with?
But due to certain reasons this was not possible.
"However, since the charge in the cylinders is pushed in by this air pressure, the engine normally produces only half-power at full throttle at this altitude."
We have to do it every day.
"If you are Indians, raise the slogan of Bharat Mata ki jai), she said."
Three persons killed in road accidents
Im just saying.
George Bernard Shaw
The police has seized the car.
Theres no traffic.
The framework agreement on Space cooperation would allow Vietnam to join hands with Indian Space Research Organization to meet its national development objectives.
How many people know her?
These drugs should be taken only with a medical prescription.
IDFC First Bank
The corporation is an autonomous body.
"Directing, acting, singing..."
But that is not the reality.
It is not mandatory to link bank account with Aadhaar .
Rs2 crore was incurred.
The revolution extends across the country.
"This theory begins with the equation of exchange: where In this formula, the general price level is related to the level of real economic activity (Q), the quantity of money (M) and the velocity of money (V)."
Home dcor accents and furnishings
Most of the problems are caused by lack of oxygen.
How long have you been married?
There is little work left.
There isnt anyone.
"""That is why he is the Chief Minister""""."""
There has been no residual impact.
Increasing air pollution
"Of what does the expression our Father remind us, and in what sense is Jehovah Father to Christians with an earthly hope?"
Danger is looming large in the future.
Anil Kapoor reportedly said that he knows Arjun very well and that he is happy with whatever makes him happy.
Are some of them distracted by the noise of satanic propaganda?
Police make 12 arrests in connection with London attack.
"""""""Indian Embassy in Nepal has deployed representatives in Nepalganj and Simikot."""
Qualification: B.Sc.
That's not the end.
A history of examples
This is having a severe impact on the economy.
Why yoga?
They did not agree to that.
They just do whatever they want.
We need police help for this.
More than 600 students participated in the event.
"Shikha Sharma, Managing Director, Axis Bank Ltd."
Electric jolt
I have been listening to abuses for the last 20 years and I have made myself abuse-proof
Booking will start soon.
Aamir Khan is currently busy in shooting for his upcoming film Thugs of Hindustan.
( b) Why did Jehovah ask his people to return to him ?
"""His first film was """"Saaransh""""."""
Your doctor will place drops in your eyes to widen your pupils and visualise your retina using a special magnifying lens.
Here are their latest pictures.
But her dreams do not end just there.
"No rain, no water."
Go to Amazon.com and log in to your Amazon account
"She comes from a family of Indian basketball players, three of her sisters currently are a member of the Indian women's national basketball team."
Is that why you stay away from the media?
Here are pictures.
"When they marched through the streets, they attracted the attention of passersby."
"And Jesus said unto him, Thou hast both seen him, and it is he that talketh with thee."
No wonder the Bible tells us that among the things that are detestable to Jehovah God are a false tongue and a false witness that launches forth lies ! Proverbs 6: 16 - 19.
Aishwaryas fathers elder brother Deenanath Rai had passed away recently.
Cardiac Rehabilitation
Im not just the CM of BJP.
These projects should be treated as National Projects.
"In the last 24 hours, 1,65,412 samples were tested"
Primary storage type
"To provide for ones own, a Christian does not need to seek material riches in this world, which will soon pass away."
Mental disorders
"Chairman GS Gill, principal LS Lamba and vice-principal SK Gill congratulated the students and teachers on this occasion."
Other apps
But I am not selling.
Reality isnt that simple.
The court granted the extension.
Our kind of love
Daughter of HCL founder and chairman Shiv Nadar.
"To download Rakhi stickers, type in raksha bandhan, rakhi or similar keywords."
Both of them decided to get married.
Small mercies!
Man commits suicide after wife refuses to go out with him
He is being treated for the disease.
Christmas celebrations have been happening all around the world.
Father's Day 2018: 8 best tech gifts for your dad
Public library
"However, Rs."
See this picture!
"Undoubtedly, however, there was some type of divine intervention."
The BJP is not for power.
"We will do everything in the interest of the state, he had said."
Og king of Bashan. for his loving kindness endures forever.
While you were sleeping...
It requires medical attention.
Dont indulge in wrongful activities.
"Hence, it is wrong to mix mythology and science."
Nissan India's executive vice president Andy Palmer has expressed the company's wish to enter the low price car section
"He said to those in Jerusalem: This is what the king of Assyria has said: Make a capitulation to me, and come out to me... until I come and I actually take you to a land like your own land, a land of grain and new wine, a land of bread and vineyards, a land of oil - olive trees and honey. and keep living that you may not die."
dict. cc Translation: German to English
"All artists, technicians and the entire team of the film were in attendance."
He was dressed in a red top and matching shoes.
Restriction for entry to the intensive care units (ICUs) and post-operative intensive care units will continue.
What do you know?
This is well planned.
Billawar is a tehsil in Kathua District which is also popular by the name of Balaur
Rs 16 crore
Session Statistics
Most notable among these are:
"Modi made it clear that an ordinance to build a Ram Mandir would arise only after the Supreme Court, which is hearing the matter, delivers its verdict."
"""It will benefit crores of people,"""" he said."""
Assembly Elections Congress Election Campaign
It is almost Rs 200 crore.
She was tired.
But super happy for everything.
But that promise has not been fulfilled.
Rani Sati Temple is located in the heart of the town of Karanjia
We were sitting facing each other.
