"If I go to the temple, others may misunderstand my action, thinking that I am compromising with those of the circumcised class."
The government should take stern measures against this.
I was immediately curious and soon got to know a whole family of pioneers.
The philosopher of science Karl Popper sharply distinguished truth from certainty.
A total of 23 cases have been registered.
Delhi High Court (Photo: PTI)
It has already written to the government in this regard.
Congress & JDS MLAs don't have faith in their own leaders & government.
Police and paramedics arrived.
A sedition case has been registered against her at the Jayalakshmipuram police station.
Rs 400 crore would be spent on it.
Transport and Goods
Point to Point
It is the crux of the film.
So how much does it cost?
Fans would love to watch them on-screen again.
This is no difficult task.
"Candidates having passed SSLC, PU, ITI, diploma or any degree can take part."
"Since during no load, there is no current flowing in one of the windings the transformer current is very less, hence the copper loss is almost absent and during short circuit test only a very small fraction of the line voltage is applied therefore, the core loss is almost 0. In order to find the temperature rise of the transformer under certain loading condition, it is necessary to emulate, both the core loss and the copper loss simultaneously."
The population had increased considerably.
Plastic has become an environmental disaster.
"But this time, the Congress and the SP-Bahujan Samaj Party (BSP) combine have failed to strike an alliance."
There is no politics in this.
Dinesh Karthik and Rohit Sharma occupy the No.
Renu Niogi
Step 2: Click on the SSLC results link
He is misleading police in interrogation.
Grant them wisdom.
They get lower wages.
The situation is aggravated by the fact that Satan the Devil is the ruler of this world.
Food and medicines were provided to them.
Do we really need it?
This is an attack on the honour of women.
"30 lakhs, they demanded."
Your actively campaigning for Trump is a breach of both India and America as sovereign nations and democracies.
"Food is distributed to around 2,000 to 3,500 needy people twice every day through Food on Wheels observing due social distancing"
Rani Mukerji is set to make her Bollywood comeback with 'Hichki'
"Hurriyat chairman Abdul Gani Bhat, executive members Mirwaiz Moulvi Umer Farooq, Mohammad Yaseen Malik, Moulvi Abbass Ansari and Bilal Gani Lone and a representative of the Jamaat-e-Islami Zahid Ali attended the meeting."
It is a romantic film.
Rahul Gandhi said in a tweet.
Australia is also set to host ICC T20 World Cup later this year
Supreme Court junks Tej Bahadur Yadav plea challenging poll panels rejection of nomination
As chief minister
Where was it stalled?
BJP district unit President Prathap Simha Nayak was present.
Woman dies of electrocution
They have Rs.
He Screamed Rebukes at Them
He said strict action will be taken against those found guilty.
Flood Redux
Benefits of the system
He was later admitted at a district hospital for treatment.
"While a diode is a useful switch, it cannot control. it cannot be turned on or off by a control signal."
"O God, how much does the grand sum of them amount to! PSALM 139: 17. 1, 2."
The situation is same everywhere.
"Other features on the Pulsar include halogen headlamp with two pilot lamps, LED tail lamp, tank shrouds, a semi-digital instrument cluster, 11.5-litre fuel tank, an engine cowl, a blacked-out muscular-looking exhaust, split grab-rails, and clip-on handlebars"
"The two Leaders viewed the displays of archaeological findings from the foothills of the Himalayas which suggest human activity possibly dating back to 2.6 million years ago, making them among the oldest known remnants of human existence."
"And old shoes and clouted upon their feet, and old garments upon them. and all the bread of their provision was dry and mouldy."
Rapport is great.
Ram is not mentioned either in election meetings or in door-to-door campaigns.
Many passengers were stranded.
Its literally true.
"""If you ask Virat Kohli would he like to be captain of India, obviously he would not say no,"""" Patel said."""
Reasons for dissatisfaction
Colours: Black/Blue/Red/ White
He died there.
"Solar energy is going to be a major source of energy needs not only today but in the 21st century, because solar energy is Sure, Pure and Secure"
Heres the truth )
BJP workers celebrated the partys victory at the party office by bursting crackers and distributing sweets.
One civilian also died in the incident.
They can do everything for the sake of their own interest.
I liked the film.
Dont litter in the forest
Major Events and Milestones
A search operation is currently underway in the area.
But when does this end?
The farmers rose in protest.
There is no official ban.
Telugu Desam leader and Andhra Pradesh Chief Minister N.T.
Total 20 teams participated in the tournament.
Sri C.R. Sridharan
"Kolkata: Striking junior doctors turned down Chief Minister Mamata Banerjees invitation for a meeting at the state secretariat, which was called to resolve the impasse, and continued their protest for the fifth consecutive day on Saturday."
Where did they get that from?
All the matches will be day-night affairs.
"If children and their spouses are living together, then it applies to them as well."
"Union Minister for Food Processing Industries, Smtrsimrat Kaur Badal addressed the opening session of Digital Indo- Italian Business Mission on Food Processing held virtually today"
No friends.
It really surprised me.
An actor said his wife wants to leave India.
"BSP won 2, Samajwadi Party 1 and Independents got 4 seats."
Do u know why?
Allergic Reactions
"Third, remember that Jehovah is the Father of tender mercies and the God of all comfort, who comforts us in all our tribulation, that we may be able to comfort those in any sort of tribulation through the comfort with which we ourselves are being comforted by God."
He demanded a high-level inquiry into the matter.
The matches will be televised live.
"The AU has also sent a peacekeeping mission to Somalia, consisting of troops from Uganda and Burundi."
"""I cannot talk."""""""
Dont confuse that.
The story of cricket will never be complete without him
Last Date of Application: 15-12-2018
"Selection: Selection of recruits is based on the order of merit on their performance in Written Test, qualifying Physical Fitness Test (PFT) and fitness in Medical Examinations."
What survey says
But they are so sweet
The background score too is decent.
"Which removeth the mountains, and they know not: which overturneth them in his anger."
"Satan the Devil, whose pride is similar to that of the Babylonian dynasty, will also meet an ignoble end. Daniel 4: 30. 5: 2 - 4, 23."
"If you dont, you have got a big problem."
The verdict was pronouced by a Delhi court.
"It is no wonder, then, that there are disagreements about religious beliefs among relatives and friends."
28-yr-old woman commits suicide
Bhartiya Janata Party (BJP) MLA from Uttar Pradesh Surendra Narain Singh in yet another controversial remark has said those who object to utter Bharat Mata ki Jai are Pakistanis.
It polled over 4% votes in the previous election.
"However, the company declined to comment."
Virat Kohli urges Delhi people to fight toxic air pollution.
"Not only has the Government no money to spend on development, but it has very few avenues for raising money."
Why do we care about society?
Prime Minister Narendra Modi has shown his 56-inch chest.
"""""""The AAP is talking about infighting in the BJP to hide its government's failures."""
The Indian government accorded formal approval.
These are very unusual results!
And following are the reasons:
There was no water in sight.
"From the point of view of the worlds oldest democracy, obviously it would be nice if the new engines are democratic engines."
"Four ministers, including Home Minister Amit Shah, Railway Minister Piyush Goyal and Shiromani Akali Dals Harsimrat Kaur Badal, have declared assets worth more than Rs 40 crore."
I tell it like it is.
Oil: 3-4 tbsp
There is no question of resigning.
Long lasting battery life
It is very important that the people are made aware of the thing.
"Not once,but twice."
The location of the incident is not known.
"He taught generations of future leaders at the LSE, including India's Jawaharlal Nehru."
"Tough one to talk about at the moment, Pearce said after Denton asked him about sharing screen space with Spacey, who was recently accused of sexual misconduct by several actors."
The workshops were reportedly active and operational a day after the cyclone passed
Read books:
"No, not as yet."
Two bus drivers were injured in the incident.
So he submitted his case and awaited the judgment of the divine court.
Dont believe everything you hear.
He has a younger sister.
"I will defend it, he said."
What is net neutrality and why is it important?
Maintain a good rapport with your spouse.
"Despite Bhishamchand's efforts to mediate between the two, the situation gets out of hand and events take a tragic turn."
Everyone wants change.
They do cry.
"Network capabilities include 3G, WiFi 802.11 b/g/n, Bluetooth 4.0 and GPS."
A highlight of our experience has been observing how Jehovah has proved to be the God of all comfort for his worshippers.
You can do it.
There was no response to the request.
is a doctor.
'Tumhari Sulu' is a fun film.
"However, he is humble. Psalm 18: 35."
It was unclear why they were held.
This is your last chance.
This is a national election.
We have successfully done that.
"While Virat Kohli will lead the side, middle-order batsman Ajinkya Rahane will play his deputy."
This is anti-democratic.
Musical Chairs
The amended Citizenship Act is being linked with the National Register of Citizens (NRC).
Who goes first?
Take for instance the case of Karnataka.
"Food: Fish, chicken, cashewnuts and rotis"
India slip out of top 100 in FIFA rankings
Budget 2020: What's become cheaper and what's more expensive?
Normal rainfall
"We are wise, therefore, to take seriously what it says about the Devil. 2 Timothy 3: 14 - 17. 2 Peter 1: 20, 21."
She couldnt keep her hands off.
"The Hyundai Venue is now the second best-selling product from the brand in India, after the Elite i20 premium hatchback"
"Lower costs, higher revenue"
Some didnt give a damn.
This is his style.
"Contemporary mentalists often take their shows onto the streets and perform tricks to a live, unsuspecting audience."
"Like India, we are also a developing nation."
think about.
"So while Jesus did not utter an untruth, he gave them an incomplete answer in order to limit the possible harm they could do to him or to his followers."
He is a very strong human being.
The man faints.
OnePlus 6 will come with 6.28-inch full HD+ AMOLED display with notch on the top.
Weaving is our profession.
The injured have been admitted to the nearby hospital.
The expectations of people were high.
So it was a choice between being a nurse or a teacher. The offer to teach came first.
Home National India gives 9-point plan at G20 to deal with fugitive economic offenders
The luxuriant vegetation has greatly helped regulate Nairobis inviting temperatures warm days and cool nights.
So I have no complaints.
He also noted that todays event was the first such occasion bringing Indias and Mauritian leaders together through a vide link across the Indian Ocean.
India caught in spin dilemma
But theres more to them.
Everything will work out fine.
If necessary take a print out or save a soft copy.
"The case is similar in Kerala as well, which too has been affected by floods"
"But that is not possible, Shivakumar said."
There can be various reasons for that.
Ive firm belief that your knowledge and experience would also prove useful for the same.
Police were immediately alerted.
We have seen evidence of this happening today.
Here is the comment:
The train was coming from Mysore.
"with our neighbours,"
Five types
Signs and symptoms of blisters
Oh brother
"To provide day-time power supply for irrigation, the Gujarat Government under Chief Minister Shri Vijay Rupani had recently announced the Kisan Suryodaya Yojana"
I am yearning to see their faces in Paradise!
"The accused Sunil Bheel was known to the parents of the infant and was sleeping close to them, police said."
Search for other is underway.
"To finance such infrastructure, we have set up the National Investment and Infrastructure Fund in collaboration with foreign funds."
In what ways do we show that we belong to Jehovah?
Be cautious while driving vehicle.
"However, till date no notification or order has been issued by the government in this regard."
Summer heat
I think the answer is obvious.
"Covering an area of 13.5 acres, the museum is housed in a sprawling campus conducive for a relaxing stroll"
Garbage is strewn everywhere.
Bollywood's gorgeous couple Deepika Padukone and Ranveer Singh are hitched.
Why is this?
We're living in a hotel.
English and French are also spoken.
"Though he was rushed to the hospital, he had passed away by then, family sources said."
VVS laxman is the mentor of Sunrisers Hyderabad.
We have to prepare well.
"Article 370 or its abrogation is not the issue, but denying citizens their right to respond to it is the main issue."
"If so, theres some good news."
The upcoming Assembly elections in West Bengal was also one of the topics of discussion at the meeting.
Home State BJP celebrates PM Modis birthday
What was he saying?
A full investigation must be made.
One such incident happened in Hyderabad city's Chaderghat.
were in attendance.
A fine of Rs 5 lakh was also imposed on him.
It calms the mind.
NIA has collected information from them.
Summer Weather
"In case of a married couple, both spouses should give their consent for adoption."
We have to move from here.
That case was dropped.
MS Dhoni not out 15
"Starting off with the cosmetic changes, the Royal Enfield Himalayan 2021 carries forward the same design and silhouette as its previous models, however, there are a few minor updates"
"""In the note it was written that Pandey, a 2012-batch IAS officer, was fed up with his life and lost his """"belief on human existence"""""""
They don't want to divide the country.
Actor-politician Nandamuri Harikrishna dies in road accident in Telangana
The government said it was facing losses.
More than 100.
Prepare a plan
Pakistan has denied that surgical strikes were carried out
"Encourage health cooperation in areas relevant to the ASEAN Post-2015 Health Development Agenda, particularly in the area of strengthening health system and access to care, as well as safe and good quality medical products and affordable quality medicines, including traditional and complementary medicines."
6 killed in boat capsize
Three others were reportedly injured in the accident.
There is tremendous improvement in health sector.
Remove the stinger.
They have fought two world wars.
How to avoid conflict?
Mobile application
"Then the frustration of physical frailty, pain, and immobility will be forgotten, for the lame one will climb up just as a stag does."
We have ended that.
Why did you leave me?
"However, in the lowlands, sun - dried or kiln - baked mud bricks were used for the walls of dwellings."
Do not boil the water.
So easy.
It has become truly difficult to love without getting hurt.
Here are the deleted tweets:
But we never talked about marriage.
I ate breakfast.
It has a wide range of colours and shades.
BJP committed to make India strong: BJP
Returning to Derby
We manage it.
"Addressing the press after releasing the AAP manifesto for New Delhi, Kejriwal said the people of Delhi want to know who would be the BJPs chief ministerial face."
Choose your 2 Lucky Stars (from a guess range of 1-12)
Each grape has distinctive flavours.
There were several different numbers reported for minimum wages set by states for unskilled labourers.
What are the causes of encephalitis?
Hussain was asked about Hindustan Aeronautics Ltds limited cash-in-hand to pay salaries.
The Board of Control for Cricket in India (BCCI) would like the second Test of the upcoming series between India and Bangladesh to be a day-night Test.
They have violated the Constitution.
"""Discussion focussed on working together for energy security and expanding mutual investment opportunities between India and US,"""" External Affairs Ministry spokesman Raveesh Kumar said in a tweet after the meeting."""
Your relation with your friends will get better this month.
Agility and ability
Expert advice and recommendations
Because of the divine principle of headship: The head of a woman is the man.
"Initially, it went well."
No wrong was committed.
Sharma Oli said.
Then follow these tips
Police have arrested the accused and a case has been registered under the POCSO Act.
There is no caste discrimination.
Drain water.
Registration of vehicles
It's for them to decide.
Chief Minister Adityanath.
This is common in India.
Rahul Gandhi hit out at the government after Union Minister Arun Jaitley announced that Chief Economic Advisor Arvind Subramanian was leaving the Finance Ministry.
Here are a couple of examples.
They have demanded the immediate disbursement of the salaries.
They demanded strict punishment for the culprits.
What is F?
Change the mindset.
He won the gold.
Stir the mixture well.
This is the first maximum of the innings.
"""We are not against peaceful demonstration""""."""
A complaint was lodged with the local police.
Everythings alright
"Later, he was appointed as state BJP president."
What foods can I eat to help me?
Thats not good for me.
But that day never came.
he has himself forgotten.
But there was no certainty about it.
This incident has taken place in Bangalore.
The legislation will be amended.
"The West Indian legend needs just 16 more runs to complete 1,000 IPL runs for the Punjab franchise"
"So, what do we trust?"
Gangaramaya Temple
29 per cent.
It should be smaller.
Supporting other educational institutions.
Police present at the spot
"for I feared you, because you are an exacting man. You take up that which you didn't lay down, and reap that which you didn't sow.'"
The driver is being interrogated.
"Vice-Chairman Lokesh Kumar Prajapati, Member Kaushalendra Singh Patel and former MP and Member of the commission Sudha Yadav were also present."
Add coconut oil in a pan.
Tests and diagnosis
Its just a natural process.
CDS will administer tri-services organisations
This will increase the temperatures here.
But how will this benefit the common man?
"Chris Morris (RR, Rs 16.25 crore)"
"He took the blind man by the hand, brought him outside the village, and, having spit upon his eyes, he laid his hands upon him and began to ask him: Do you see anything?"
BJP Govt will complete its full tenure.
Everyone spoke.
Prevents infections
BJP president Amit Shah will be the Home Minister in the newly constituted Cabinet under PM Narendra Modi.
Wearing a face mask is mandatory for all passengers and staff.
Electricity department
It has a humanising effect on man.
No great loss that.
Stock market in bear grip
It is applicable everywhere.
Why does this still continue to happen?
"Senior advocate Indira Jaising, representing Bindu, contended before the court: We are all here to avoid violence, this country based on the foundation of non-violence, we do not encourage violence."
Leave on until it dries up.
You need to leave it overnight and wash off in the morning.
I have not told anybody.
Nearly 400 people have died while several lakhs have been displaced
This is a wrong notion.
"Whatever they had to do, they did it."
Around 100 law students from across the country have written to the Chief Justice of India (CJI) requesting him to take strict action against Andhra Pradesh Chief Minister Jaganmohan Reddy for his alleged contemptuous conduct against Supreme Court's second senior-most judge Justice NV Ramana.
You please tell me if you know of any.
Isnt this wrong?
Current Week (Mon-Sun)
The film became a major box office success despite negative reviews from critics.
second term.
What is sex?
'Real star' Upendra's homecoming
"It was for the fourth time, China blocked Azhar's listing as a global terrorist by the UN"
This is a very important step.
What is the hurry?
The Ancient Art of Tattooing Tattooing is by no means a modern practice.
High taxes.
Didn't Indira Gandhi win the Bangladesh liberation war against Pakistan?
This has been a common issue with most of the students.
"Therefore, before starting this treatment, consult your doctor."
Several drugs are being tried across the world to fight coronavirus.
Doctor dance
A PIL had been filed in the Supreme Court in this regard.
The number is very less.
Can you answer that?
Little did I know at the time what sort of challenges we as a family would still have to face.
So it has been a failure.
Want to join them?
What is this game?
India has to globalise.
Demand for PMs resignation
He also became the third most capped player in international cricket.
"Hyundai Santro is currently available in five variants: D-Lite, Era, Magna, Asta and Sportz."
Rainfall is common in this season.
He asked the people to cooperate with municipality.
"Later, prizes were distributed to the winners."
This is the main road.
Many cases were registered against him.
Millions lured into gambling have found themselves ensnared by a vicious gambling addiction.
A lot has changed in this period.
It can also lead to liver failure.
Respiratory problems are common.
"But, there is always another option."
Three patients have died in the state.
The identity of another was not disclosed to the media.
The audience liked this film too.
"""""""Today is the day of rise of most natural and deserving Rahul Gandhi as President of the oldest and respected party of India."""
But nothing has been confirmed as of yet.
"Prime Minister Narendra Modi, flanked by BJP president Amit Shah and Madhya Pradesh chief minister Shivraj Singh Chouhan, during the BJPs Karyakarta Mahakumbh in Bhopal."
There will be a big profit in business.
I didnt think about it back then.
Vijay Deverakonda is the pillar of the film.
The vehicle rally passed through Hudikeri-Ponnampet-Gonikoppa-Virajpet-Moornadu before reaching Madikeri.
It has not been discussed in the Cabinet.
Each team will have three members.
Slice it
The community falls under Other Backward Caste (OBC).
"In the East, we have strengthened our traditional partnerships with Japan, Korea and ASEAN."
That law includes all that Jesus taught.
At railway station
Why like this?
The 15 districts:
"""""""Let us remember: One book, one pen, one child, and one teacher can change the world."""""""
"Marcos, a widower, received comfort from friends who visited him."
Chinese nuclear submarine spotted at Karachi
"Its not about the dress, its not about the food."
Privatisation of public sector banks
Sold at higher price
So its very important to understand.
The people know the candidates of the Congress and BJP.
Man injured in bear attack
"That is very, very important for us."
This does not hold water.
"Chennai: In a shocking incident, a woman allegedly killed her former boyfriend by smashing his head after he insisted that the woman resume her relationship with him."
65 crore
The case is being probed by an ACP-rank officer.
"As I watched over my father in the hospital, I decided that I wanted to be a nurse. Etsuko Kotani, Japan."
A number of theft cases have been reported.
Keep a gratitude journal.
"The video has been viewed more than 10,000 times."
Accept this.
What document is needed?
50 crore per acre.
"Of the sons of Pahathmoab: Adna, and Chelal, Benaiah, Maaseiah, Mattaniah, Bezalel, and Binnui, and Manasseh."
Find out what they are.
"working together to keep the Web open, public and accessible to all."
Read on......
Mahendra will preside.
These are such people.
Why do so many different religions claim to be Christian?
We want to make good films.
Need to be patient.
Benefits of drinking beetroot juice
I met her there.
The role of parents is most important.
"Russia is the worlds second-largest producer of crude oil, while Saudi Arabia is the worlds largest exporter."
Safety Package
Police in this case arrested the school bus conductor Ashok Kumar.
The phone also brings a 48-megapixel primary camera with the Pro variant getting a Sony IMX586 sensor.
The taxi version of the Maruti Alto draws power from the same 796cc three-cylinder petrol engine that produces 47bhp and 69Nm of torque
It was scary at first.
But often tempers flare.
India were eventually bundled out for 183 runs inside 54.4 overs.
Only one individual is there.
"After a period of seven times, the tree would grow again."
For you to speak for them?
You will lose your job.
Modi provided that.
Path of the device in sysfs
Perhaps it did not fit in with the decor of the house.
"Pammi Sai Charan Reddy, another advertiser, spent Rs 26,400 to promote YSR Congress Party candidates."
But how do we use the rest of our time and energy?
A Call can change your life
Pitch Report:
First chair
Winning two is not easy.
There has been a debate on the usage of bouncers in international cricket ever since Hughes' tragic demise.
Others remain unknown.
Deepa said.
We will repair the road by next week.
They dont understand Hindutva.
"24 people are reported killed, and over 30 wounded"
