"So, you should be aware of the new tax deduction rules."
He is alleged to have committed irregularities.
"God is faithful, the Bible tells us, and he will not let you be tempted beyond what you can bear. 1 Corinthians 10: 13."
Train and air services have been affected.
Place your palms on the floor and your head on your knees.
That's not arrogance.
"Why not Parliament, Rashtrapati Bhavan, Qutub Minar and Red Fort?"
So does the government.
It also includes an internal storage of 64GB.
have you come from?
More than a million people saw it.
"When ending a conversation, we do well to ask the person when it would be convenient for him to see us again."
Eat less fatty food.
The BJP leader said.
Farmers are facing problems.
I don't have a sense of urgency.
A case has been registered at Alanahalli Police Station in this regard.
Those in the car sustained minor injuries.
He didn't take food.
Attorney General G E Vahanvati had contended that there should not be any reluctance in hearing the government's view before subjecting a senior bureaucrat to investigation.
The development comes after Shiv Sena and BJP are in a scuffle over government formation in the State.
Ginger has anti-inflammatory and anti-bacterial properties.
Police has arrested one person and booked seven others in connection with the incident.
Photo goes viral.
But how can you do so?
What does it mean for users?
"However, police prevented them."
"""The men said to Lot, """"Do you have anybody else here? Sons-in-law, your sons, your daughters, and whoever you have in the city, bring them out of the place:"""
These have been discussed in this article.
"When Josiah heard the words of the Law being read to him and recognized the errors of his people, he ripped his garments apart. 2 Ki."
Never wear tight or knee high socks.
Tackling air pollution
One of them died on the spot while the other two were declared brought dead ar the hospital.
The village doesnt have a potable water supply.
The infuriated residents raised slogans against the officials.
Over 120 private engineering colleges opt for progressive closure
Can they give birth to healthy children?
Congress has written to Goa Governor Mridula Sinha (in pic) and staked claim to form the next government.
Hopefully yes.
"Sushma Swaraj, BJP leader"
Congress leader K C Venugopal has come to Bengaluru.
What do you do
"All things have I seen in the days of my vanity: there is a just man that perisheth in his righteousness, and there is a wicked man that prolongeth his life in his wickedness."
"Although I know that my parents are right not to let me go to such places, I still feel the temptation."
Updates installed
"""By legal equity, Nehru intended to """"erase distinctions within the Hindu community and create Hindu social unity...."""
Jio recorded more than double the download speed of its closest competitor Vodafone.
The Best Actor award was won by actor Akshay Kumar.
I have good relations with everyone.
And the cherubims were lifted up. This is the living creature that I saw by the river of Chebar.
But the fact is to the contrary.
A case has been registered in Byndoor police station.
"Due to heavy rainfall, houses have submerged in water."
Many steps have been taken.
Nagaraju and Dr. Jayanth and others were present.
"However, the government had not acted upon it."
to the opposing goal.
Three Killed In Cylinder Blast
"His father, Hakeem Sayyed Abul Hasan was a Sufi."
"Karnataka Chief Minister HD Kumaraswamy, former prime minister and JDS supremo HD Deve Gowda and Bengaluru Mayor Gangambike Mallikarjun mourned Ramila's death."
Lakhs of crores every day
Gone for 30.
"The body was sent to the Community Health Centre, Bawal, for a post-mortem examination."
"""""""The Chief Minister should resign immediately."""
"Batting first,Maharashtra put on 287 runs for the loss of five wickets in their allotted 50 overs."
Students performed different cultural activities.
This is a successful example of a strong partnership/ for long lasting results
This has devastated Pakistan.
Wife's husband
Union Minister for AYUSH Shripad Naik. Minister for Water Resources Filipe Nery Rodrigues. Opposition leader Digambar Kamat. Rajya Sabha MP Vinay Tendulkar. MGP MLA Ramakrishna Sudin Dhavalikar. Goa Forward Party chief and MLA Vijai Sardesai. NCP legislator Churchill Alemao. Advocate General Devidas Pangam. president of Mhadei Bachao Abhiyan Nirmala Sawant and secretary Rajendra Kerkar. WRD secretary Sanjay Gihar. chief engineer of WRD Sandip Nadkarni and others were part of the delegation.
Parents you play a major role in the spiritual development of your children.
"""Contrary to his wish to be buried at Rochester Cathedral """"in an inexpensive, unostentatious, and strictly private manner"""", he was laid to rest in the Poets' Corner of Westminster Abbey."""
"NEW DELHI: Last week,"
Police overreacted.
He died of suffering severe heart attack.
Dont talk to me.
Everybody is grey.
There have been changes among people and society.
This has already been stated.
This includes animals and birds too.
What are the unique features of the Rafale?
Focus on rainwater harvesting
"This time, the Congress will have a Leader of Opposition in the Lok Sabha."
We have tried to contact him also but he has not been available.
"In the previous day's trade, gold fell sharply in price by 0.79% or Rs."
India and the United State signed the Basic Exchange and Cooperation Agreement (BECA) on the sidelines of the 2+2 dialogue
"""Seeking extension of custody, the CBI counsel VK Sharma had said it was able to gather some information even though Karti was """"evasive"""" while answering routine questions"""
"In Madhya Pradesh, Chhattisgarh and Rajasthan the BJP had achieved clear majority."
I don't think this is something dangerous.
"No one trading with Iran will do business with America, he said"
Legislative assembly members are elected directly by the people.
His wife and a nephew were there.
2012 is not that far.
Processions and demonstrations.
How can families maintain peace in the household?
Thats why he is where he is.
Morris Garage (MG) Motor India announced today that bookings for its much-awaited MG Hector will officially begin on 4 June 2019
"KJP leaders Dhananjaya Kumar,Ramachandra Baikampady, Ravindra Shetty, Azeez Baikampady, Sukesh Kumar, Gokuldas Bhandarkar, Ravindra Oppanthaya and others were present."
Agarwal Hospital.
"Out of this, projects worth more than Rs 19 lakh crore are allocated for the development of Highways alone."
Rs 200 onwards.
"The new cases include 471 from Maharashtra, three from Delhi, two each from Andhra Pradesh, Telangana and Haryana, and one from Tamil Nadu"
The Suzuki Inazuma will most likely be on display at the forthcoming 2012 Delhi Auto Expo
Environmental Benefits
Hat-trick Hero Shivarajkumar.
There are three main categories of languages.
I will die for cinema.
Minister of State
Of these three are retired.
"The Gujarat government wants normalcy to return so that migrant workers can toil for the prosperity of Gujarat, while the Bihar government, which is at its wits end trying to manage the sudden inflow of returning migrants, wants migration to Gujarat to continue as before."
Which way will this one go?
No person should be spared.
I could not control emotions.
People are running out of groceries.
Love has no boundaries.
Heres the answer.
WhatsApp has a billion active users.
It is truly magical.
Probably they dont know it.
CRPF jawan killed in Naxal attack
Running iOS 8 or later.
Residents of the locality have lodged a complaint with the police in this regard.
"The 131 ft high monument hosts a 11.25 ft tall idol of Bhagwan Rishabhdev, seated in Padamaasan"
The money has been sent to the Prime Minister Relief Fund.
I shivered all night.
This is an encouraging response.
Education plays a significant role in the development of a country.
Add 3 teaspoons of olive oil and mix well.
"The Huffington Post noted that the producers of the show would have anticipated the potential of this story arc, by deliberately presenting Boyle in a manner that would enhance this initial reaction."
"""""""Women should be made aware of themselves."""
Thats a very good idea.
"The exports to India accounted for only 2% of Chinas total exports, Xie noted."
What ignited them?
"An important initiative of the government is market reforms, with a view to ensuring that the farmers benefit from remunerative prices for their produce in the market."
"Deepak Mukherjee was elected as president, Om Prakash Sahu and Vikram Chouhan as vice-president, lokesh Keshri as secretary, Amit Verma and Vinod Kumar Mahto as asst secretary and treasury head Vinod Prasad."
Botanical garden
Union Home Affairs Minister and BJP National President Amit Shah
3 run over by train
The list as follow:
Nowhere I see myself!
God's picture
Android 2.1 and Android 2.2
"Stay physically active: In order to get a good nights sleep, you need to be physically active throughout the day."
"Mahindra is gearing up to launch the KUV100 NXT - the facelifted version of the KUV100 - in India on October 10, 2017"
Youre misbehaving with me.
"Leviathans scales are tightly closed, and embedded in its hide are bony plates hard to pierce with bullets, much less with swords and spears."
How to grow
But thereafter everything was smooth.
Wheres the fun in that?
The person then sought treatment at General Hospital in Kasaragod.
Police sources said that four people have been arrested so far.
This is a respite.
"Every aspect of the Devils system of things will be gone forever, and Gods Kingdom will rule unopposed over all the earth. Read 2 Peter 3: 7, 13."
I am supporting it.
Its everybody.
It's not disrespect.
The criminals looted their jewellery.
Democracy should be safeguarded.
But I will tell you something.
It could be any Indian city.
There were no doctors at the hospital.
A big dream
There is 32 GB internal storage.
"Private buses, state transport buses (KSRTC) and autorickshaws have not been operating services, although private vehicles are not being stopped."
WhatsApp has been banned in China.
Then come back.
"Although we are simply imperfect earthen vessels, the message we preach can bring everlasting life to us and to those who listen to us."
"11,000 or below."
It'll give your skin a glow.
But the result was identical.
Are you similarly moved to laud Jehovah? How Are You Affected by Gods Dignity and Splendor?
"Still Camera: 8 megapixel auto-focus camera with face detection, touch focus and image stabilization. LED flash, front facing camera, video-calls."
He was speaking at a press conference here.
Our people are there.
as follows :
Not you again!
What have we been fighting for?
How do you tell that to a child?
Where is the programme?
She closed her eyes.
You should look for:
Cabinet approves setting up of the 15thFinance Commission
"Just as Jehovah foretold in the dream he sent to Pharaoh, the seventh year of bumper crops was followed by a drastic change."
Karnataka Governor Vajubhai Vala administers oath to new State cabinet ministers at Raj Bhavan in Bengaluru.
Then came the fire.
"Not one, not two, not three."
What is life without any ambition?
Straighten your hair.
The project is being implemented in two phases.
He has contributed greatly towards the development of the country.
"It will be implemented, he said."
Congratulations to External Affairs Minister Sushma Swaraj and her entire team at Ministry of External Affairs and diplomatic missions for their untiring efforts that have led to Indias re-election to ICJ.
The Prime Minister should intervene.
I have had many such dreams.
This was conveyed by the Iranian president in a phone conversation with Pakistan Prime Minister Imran Khan.
"Now, neglecting the impedance of the transformer, impedance drop of the transformer at no load this should be equal to the applied voltage."
Her mother remarried and had another son.
"""He told Kurt Loder of Rolling Stone magazine: """"I've never said I'm born again."""
Are you talking to others?
"Cry and howl, son of man: for it shall be upon my people, it shall be upon all the princes of Israel: terrors by reason of the sword shall be upon my people: smite therefore upon thy thigh."
"Why is the government not confirming this, he asked."
The image and video had gone viral.
That was the first defeat for India at the ongoing event.
He had also won Filmfare Award for Best Actor for the same.
Dont say anything.
Woe unto us! who shall deliver us out of the hand of these mighty Gods? these are the Gods that smote the Egyptians with all the plagues in the wilderness.
The same tradition is till this day continued.
It is essential to make farmers understand this.
"""Otherwise there will be conflict."""""""
This gives relief to sore throat.
It is not about the Congress or the BJP.
It is a stunning picture.
How to check your name in voter list:
Director Geetha
We have blacks... black people around us.
The second thing is more important.
It was a good lesson in what Gods spirit can accomplish.
Townspeople who follow an upright course promote peace and well - being and build up others in the community.
But there many obstacles.
"Gurupura, Karnataka, India is a small town situated on the Phalguni, or Gurupura River."
Not that I wanted them to.
A proposal in this regard will be sent to the state government.
But it cant be accepted.
Kamal launches 'Makkal Neethi Maiam' party
"Sound good, right?"
They did not need to indulge in it.
Substituting with
"The wife of the deceased, her mother, a neighbour and the driver, were seriously injured."
Cabinet approves the Revised Cost Estimate of Punatsangchhu-II Hydroelectric Project in Bhutan
Dravid batting 155
Set achievable targets
Good nutrition is the most important part of losing weight.
Which is the best form of cardiovascular exercise?
"What priceless opportunity is available to all in the congregation, and how can we take full advantage of it?"
Our country is an agriculture-based country.
Offering to god
Ranveer Singh and Deepika
Do let us know
He was immediately rushed to a nearby hospital where doctors cut the helmet's ribbon and removed it.
The proposal was not approved.
The trial has been completed and the judgment is reserved.
"In the way of qualities, abilities, and privileges, what do any of us have that we did not receive from Jehovah?"
Conditions at work will be favorable.
But the plan was not implemented.
"Unfortunately, breakfast foods commonly consumed in India are not made for good health."
"Also, spin bowling duo of Yuzvendra Chahal and Kuldeep Yadav failed to make the most of the wicket."
I am particularly grateful to you for our security cooperation.
But its not available yet.
Vatu-what?
He talks very good English.
"The government should make a statement, he said."
Why should it be?
Whats web development?
5 crores.
He said no problem.
Some who devote themselves full - time to share in the disciple - making work do receive assistance to defray their transportation costs and other personal expenses.
He sensitises people on maintaining sanitation and hygiene along with proper cooking of meat and fish.
The government will table the proposal in the next Cabinet meeting.
"Environment, Forest and Climate Change Minister Prakash Javadekar."
His desire to attain God got intensified.
Incentivise change.
What legal experts say
"Praying for Arunachal Pradeshs continuous growth, the Prime Minister said."
30 p.m.
"But, the Congress will not let this happen."
Women voters
Representatives of trade associations and members of the chamber were present on the occasion.
Top-Up Plan
Ahmed Rashid says.
How much was exfiltrated?
I dont know for sure.
Characteristic features
The MLAs were then travelling in a bus to Hyderabad.
Here are some easy home remedies.
A case has been registered at Kadaba police station.
"Purge out the old yeast, that you may be a new lump, even as you are unleavened. For indeed Christ, our Passover, has been sacrificed in our place."
"""""""Thank you dada."""
Would I leave?
But thats true.
"Seeing this, the villagers informed the police."
High buildings
This means you need to plan proactively for your retirement.
Cookery contest:
KPCC general secretary K.P.
"'', Modi tweeted."
Mahendra Singh Dhoni has quit as a captain of the Indian team.
Wedding clothes
"According to a legend, Lord Adikesava Swamy killed the demon Kesi in a fierce battle"
Its about human relationships.
"Besides birds, tourists can also witness animals, such as black bucks, pythons, sambars, spotted deer and nilgais"
Uttar Pradesh Chief Minister Yogi Adityanath kept 37 departments with himself.
Salary Rs 8000 pm.
"Admittedly, the forces described above are powerful."
"Choose whether %@ blocks ad, analytic, social, and other trackers."
And he hath slandered thy servant unto my lord the king. but my lord the king is as an angel of God: do therefore what is good in thine eyes.
"Prithviraj Kapoor's eldest son, Raj Kapoor became one of the most popular actors in the film industry."
How correct is this?
Add vinegar and ice cold water and mix it.
There is no Anganwadi Centre(AWC) in the village.
"But the government, even in this current state, is stable."
The students protests...
"""""""A public programme 'Namaste Trump' to welcome US President Donal Trump will be organised in Ahmedabad."""
"The award comprises a medallion, a certificate, and a cash prize of Rs 7.5 lakh."
New Zealand captain Kane Williamson also climbed up one place each to occupy second position among batsmen.
New in the market
He says Narendra Modi should become the Prime Minister again.
Police personnel on duty.
Candidates are required to pay an application fee of Rs 250.
"However, he was not found there."
I'm afraid of what might happen.
People know that.
The video had gone viral.
Nodal officers and officials participated in the meeting.
It wasnt worth it.
The body was found at his residence.
"Trust is an important component, then, of ensuring that citizens overcome fear and participate fully in public life."
of April 2009 warned against sexual fantasies involving someone other than your marriage mate.
"And he saith unto him, Out of thine own mouth will I judge thee, thou wicked servant. Thou knewest that I was an austere man, taking up that I laid not down, and reaping that I did not sow:"
Highest Attendance
Did you expect that the movie would be this successful?
The film is directed by Varun's father David Dhawan.
English teachress
I started writing.
No complaint was lodged with the police.
Madurai couple claims Dhanush their son: Court summons actor
"However, she later deleted the video"
BJP steps up protest
Press Censorship was promulgated.
Roads are not being repaired.
It received 73.7% polling.
There is a sea wall lining the coast where you can sit and enjoy a beautiful view
The coachs and the captains relationship is good.
"Fortunately, the driver and cleaner of the lorry escaped unhurt in the mishap."
"""""""But why must you go?"""""""
Antibodies are protective proteins generated by the immune system in response to an invading pathogen.
There is however no parking available at the site.
On pricing and registering a CBI FIR
This should not be done.
"Another perfect human life, corresponding in value to that of Adams, had to be paid to balance the scales of justice."
It is feared that more victims are buried under the debris of the building.
But what followed was different.
"""""""I like Salman Khan."""
"However, there has been no official confirmation on this."
Thank you V
Income: Rs 15 lakh
An idea flashed in my mind.
"Increase in DA for SC, HC judges"
Drink water before eating
"However, it is not anything bad."
Book a ticket.
"If I perform this willingly, I have a reward. but if I do it against my will, all the same I have a stewardship entrusted to me. 1 Corinthians 9: 16, 17."
It removes dead skin cells and keeps skin fresh.
"So with the approval of Ben - hadad, the king of Syria, Naaman and some attendants make the long trip of about a hundred miles [about 150 km] to find Elisha."
JD (U) is contesting the elections in alliance with the BJP.
"In answer to that prayer, Jehovah will remove wickedness from the earth, thus sanctifying himself. Ezek."
But this is not a permanent thing.
This feature is available to all users.
All the shops remained closed.
"Shops, business establishments and hotels remained closed."
Rohits century in 35 balls was the joint-fastest T20I ton.
Farmers stage protest against PWD
"""""""But the residents had complained that they are not receiving enough water."""
"The Bible encourages us to cultivate qualities that foster good mental health, qualities such as compassion and forgiveness."
25 g ginger
"Digital India: Ambani brothers, industry shower praises on PM Modi"
"those who were numbered of them, of the tribe of Issachar, were fifty-four thousand four hundred."
"It is like a river, flowing constantly."
People should understand this.
It is for the first time that BJP won this seat.
This causes stress.
Its an action packed drama.
The Bharat Bandh was not a success.
Police said that the suicide note cited financial problems as the reason behind the extreme step
But it didnt trickle.
North Korea is an example.
"According to the complaint, two assistant teachers and a junior teacher forced 88 students to undress before other students following the recovery of a piece of paper containing vulgar words about the head teacher and a girl student."
"""Terrorism is terrorism,"""" he said."""
I would wake up early morning and exercise.
Where do you goIJ
The police promptly arrested them.
Institute of law
Australia win by 34 runs
Ive grown up in Bangalore.
This was fulfilled when Gods enemies caused Jesus Christs death on a torture stake.
Facilities Needed
Coal is not the only carrot.
"37,334 students scored full A+ in all subjects."
"Indeed, Gods chosen people were warned: Watch yourself that you do not conclude a covenant with the inhabitants of the land to which you are going, for fear it may prove itself a snare in your midst."
Investment in mutual funds can be one of the best options to invest after demonetization.
They are looking for others.
( Read Titus 2: 14.)
But there were no such opportunities.
"We shall abide by the courts orders, he says."
Justice John Paul Stevens of the U.S.
Shree Ramthe thread of unity in diversity
But people don't know that.
The reason for the murder is not known yet.
So it is important to avoid direct sunlight.
Stay tuned to know more!
It was a non-political organisation.
Who is in the show?
Did you see it?
"When does the calling of Christians to a heavenly hope cease? May 1, 2007, pages 30 - 31."
"Law Commission endorses proposal for simultaneous Lok Sabha, assembly polls"
On the occasion prizes were given to painters and artists.
He said he will give Rs 2 lakh to him.
There is a lot of travelling this month.
Police have arrested the driver.
"Then, wash off with warm water."
This photo became very viral over here.
"During the little time that parents and children are together, communication competes with and often loses out to computers, television, and other electronic media."
Additional amenities and projects
But this is not the way.
He lost his father at an early age.
Maharashtra came under President's Rule after no party was able to form the government after the assembly polls.
But there is no wave.
"The Shai Gates minarets are worthing of watching, adding to the splendid beauty of the mosque"
Aishwarya Rai Bachchan is a renowned Bollywood actor.
KGF has become the first Kannada film to release in Pakistan.
The consistency should neither be too thick nor too thin.
She had no answer.
"Mormugao BJP president Sanjay Satardekar, Mormugao Municipal Council deputy chairperson Shashikant Parab, Ravindra Bhavan-Baina president Shekhar Khadapkar, MMC councillor Bhavana Bhosle, Damodar Kaskar, Mormugao BJP mahila morcha president Chayya Shetgaonkar, Chandrakant Gawas were present among others."
They do love you
Do the Gospels contain fables or facts?
Cases have been registered.
"Puneet Gupta, Sant Kumar, Deepak Saini, Nitin Mehtani, Ashok Punia, Kailash Sain, Devender Sheoran, Devender Singh, Pranav Kush, Manoj Choudhary, Lokesh, Ranchal Choudhary, Nitin Rathee, Manav Yadav, Ankit Rawat, Rahul Rana, Sunil Sheoran, Akankshu Dhawan, Jagpal Malik, Lalit Vashishta and Hemant Bansal."
But where is the museum?
A large number of devotees participated in the puja.
What is the result of that?
The body of the girl has been sent for post-mortem examination.
The trailer has increased the expectations on the film.
"""We will wait and see,"""" he said."""
The film is proposed to release in January next year
We found it true.
"The film, directed by Sujeeth, stars Prabhas and Shraddha Kapoor."
The attack is condemnable.
They vandalized Ishwar Chandra Vidyasagar's statue.
People of Delhi have outrightly rejected the BJP.
There are a lot of changes.
Another vexing silver
Benelli will be introducing BS6 models soon in the Indian market
Chandan Shetty
The BJP have also approached the election commission with this complaint.
"The participants in the workshop were members of different NGOs, social activists and panchayat representatives."
Its not the first attempt at this.
PM's visit to the US
Latest Movies
"the Juvenile Justice (Care and , 2000"
The government should correct things.
Yellow alert has been issued for these districts
It doesn't matter to me.
"However, thats a wrong notion."
It can even be purchased online.
